id,doi,title,authorString,authorAffiliations,journalTitle,pubYear,isOpenAccess,keywords,nationalPriorities,healthCategories,abstract,laySummary,urls
32375776,https://doi.org/10.1186/s12916-020-01597-8,Quantifying the impact of physical distance measures on the transmission of COVID-19 in the UK.,"Jarvis CI, Van Zandvoort K, Gimma A, Prem K, CMMID COVID-19 working group, Klepac P, Rubin GJ, Edmunds WJ.","Centre for Mathematical Modelling of Infectious Diseases, Department of Infectious Disease Epidemiology, London School of Hygiene & Tropical Medicine, Keppel Street, London, WC1E 7HT, UK. Christopher.Jarvis@lshtm.ac.uk.; Centre for Mathematical Modelling of Infectious Diseases, Department of Infectious Disease Epidemiology, London School of Hygiene & Tropical Medicine, Keppel Street, London, WC1E 7HT, UK.; Centre for Mathematical Modelling of Infectious Diseases, Department of Infectious Disease Epidemiology, London School of Hygiene & Tropical Medicine, Keppel Street, London, WC1E 7HT, UK.; Centre for Mathematical Modelling of Infectious Diseases, Department of Infectious Disease Epidemiology, London School of Hygiene & Tropical Medicine, Keppel Street, London, WC1E 7HT, UK.; Centre for Mathematical Modelling of Infectious Diseases, Department of Infectious Disease Epidemiology, London School of Hygiene & Tropical Medicine, Keppel Street, London, WC1E 7HT, UK.; Department of Psychological Medicine, King's College London, Denmark Hill, London, UK.; Centre for Mathematical Modelling of Infectious Diseases, Department of Infectious Disease Epidemiology, London School of Hygiene & Tropical Medicine, Keppel Street, London, WC1E 7HT, UK.",BMC medicine,2020,Y,Pandemic; Disease Outbreak; Reproduction Number; Ncov; Covid-19; Contact Survey,,,"BACKGROUND:To mitigate and slow the spread of COVID-19, many countries have adopted unprecedented physical distancing policies, including the UK. We evaluate whether these measures might be sufficient to control the epidemic by estimating their impact on the reproduction number (R0, the average number of secondary cases generated per case). METHODS:We asked a representative sample of UK adults about their contact patterns on the previous day. The questionnaire was conducted online via email recruitment and documents the age and location of contacts and a measure of their intimacy (whether physical contact was made or not). In addition, we asked about adherence to different physical distancing measures. The first surveys were sent on Tuesday, 24 March, 1 day after a ""lockdown"" was implemented across the UK. We compared measured contact patterns during the ""lockdown"" to patterns of social contact made during a non-epidemic period. By comparing these, we estimated the change in reproduction number as a consequence of the physical distancing measures imposed. We used a meta-analysis of published estimates to inform our estimates of the reproduction number before interventions were put in place. RESULTS:We found a 74% reduction in the average daily number of contacts observed per participant (from 10.8 to 2.8). This would be sufficient to reduce R0 from 2.6 prior to lockdown to 0.62 (95% confidence interval [CI] 0.37-0.89) after the lockdown, based on all types of contact and 0.37 (95% CI = 0.22-0.53) for physical (skin to skin) contacts only. CONCLUSIONS:The physical distancing measures adopted by the UK public have substantially reduced contact levels and will likely lead to a substantial impact and a decline in cases in the coming weeks. However, this projected decline in incidence will not occur immediately as there are significant delays between infection, the onset of symptomatic disease, and hospitalisation, as well as further delays to these events being reported. Tracking behavioural change can give a more rapid assessment of the impact of physical distancing measures than routine epidemiological surveillance.",This paper utilises questionaire data and modelling data to identify the likely reduction of contacts a person encounters in a day. The study estimated a 74 % reduction in contacts per day which will have an influence in the spread of COVID-19.,doi:https://doi.org/10.1186/s12916-020-01597-8; html:https://europepmc.org/articles/PMC7202922; pdf:https://europepmc.org/articles/PMC7202922?pdf=render
32855306,https://doi.org/10.1136/gutjnl-2020-321650,Prioritisation by FIT to mitigate the impact of delays in the 2-week wait colorectal cancer referral pathway during the COVID-19 pandemic: a UK modelling study.,"Loveday C, Sud A, Jones ME, Broggio J, Scott S, Gronthound F, Torr B, Garrett A, Nicol DL, Jhanji S, Boyce SA, Williams M, Barry C, Riboli E, Kipps E, McFerran E, Muller DC, Lyratzopoulos G, Lawler M, Abulafi M, Houlston RS, Turnbull C.","Division of Genetics and Epidemiology, Institute of Cancer Research, London, UK.; Division of Genetics and Epidemiology, Institute of Cancer Research, London, UK.; Division of Genetics and Epidemiology, Institute of Cancer Research, London, UK.; National Cancer Registration and Analysis Service, Public Health England, London, UK.; RM Partners, West London Cancer Alliance, London, UK.; Microbiology, Royal Marsden NHS Foundation Trust, London, UK.; Division of Genetics and Epidemiology, Institute of Cancer Research, London, UK.; Division of Genetics and Epidemiology, Institute of Cancer Research, London, UK.; Urology Unit, Royal Marsden NHS Foundation Trust, London, UK.; Division of Clinical Studies, Institute of Cancer Research, London, UK.; Department of Anaesthesia, Perioperative Medicine and Critical Care, Royal Marsden NHS Foundation Trust, London, UK.; Division of Cancer Biology, Institute of Cancer Research, London, UK.; Department of Colorectal Surgery, Oxford University Hospitals NHS Foundation Trust, Oxford, UK.; Department of Clinical Oncology, Imperial College Healthcare NHS Trust, London, UK.; Computational Oncology Group, Imperial College London, London, UK.; RM Partners, West London Cancer Alliance, London, UK.; School of Public Health, Imperial College London, London, UK.; RM Partners, West London Cancer Alliance, London, UK.; The Breast Unit, Royal Marsden NHS Foundation Trust, London, UK.; Patrick G Johnston Centre for Cancer Research, Queens University Belfast, Belfast, UK.; The Breast Unit, Royal Marsden NHS Foundation Trust, London, UK.; National Cancer Registration and Analysis Service, Public Health England, London, UK.; Epidemiology of Cancer Healthcare & Outcomes (ECHO) Group, University College London, London, UK.; Patrick G Johnston Centre for Cancer Research, Queens University Belfast, Belfast, UK.; Colorectal Surgery, Croydon Health Services NHS Trust, Croydon, London, UK.; Division of Genetics and Epidemiology, Institute of Cancer Research, London, UK.; Department of Clinical Genetics, Royal Marsden NHS Foundation Trust, London, UK.; Division of Genetics and Epidemiology, Institute of Cancer Research, London, UK clare.turnbull@icr.ac.uk.; National Cancer Registration and Analysis Service, Public Health England, London, UK.; Department of Clinical Genetics, Royal Marsden NHS Foundation Trust, London, UK.",Gut,2020,Y,Colonoscopy; Colorectal Cancer; Colorectal Cancer Screening,,,"OBJECTIVE:To evaluate the impact of faecal immunochemical testing (FIT) prioritisation to mitigate the impact of delays in the colorectal cancer (CRC) urgent diagnostic (2-week-wait (2WW)) pathway consequent from the COVID-19 pandemic. DESIGN:We modelled the reduction in CRC survival and life years lost resultant from per-patient delays of 2-6 months in the 2WW pathway. We stratified by age group, individual-level benefit in CRC survival versus age-specific nosocomial COVID-19-related fatality per referred patient undergoing colonoscopy. We modelled mitigation strategies using thresholds of FIT triage of 2, 10 and 150 µg Hb/g to prioritise 2WW referrals for colonoscopy. To construct the underlying models, we employed 10-year net CRC survival for England 2008-2017, 2WW pathway CRC case and referral volumes and per-day-delay HRs generated from observational studies of diagnosis-to-treatment interval. RESULTS:Delay of 2/4/6 months across all 11 266 patients with CRC diagnosed per typical year via the 2WW pathway were estimated to result in 653/1419/2250 attributable deaths and loss of 9214/20 315/32 799 life years. Risk-benefit from urgent investigatory referral is particularly sensitive to nosocomial COVID-19 rates for patients aged >60. Prioritisation out of delay for the 18% of symptomatic referrals with FIT >10 µg Hb/g would avoid 89% of these deaths attributable to presentational/diagnostic delay while reducing immediate requirement for colonoscopy by >80%. CONCLUSIONS:Delays in the pathway to CRC diagnosis and treatment have potential to cause significant mortality and loss of life years. FIT triage of symptomatic patients in primary care could streamline access to colonoscopy, reduce delays for true-positive CRC cases and reduce nosocomial COVID-19 mortality in older true-negative 2WW referrals. However, this strategy offers benefit only in short-term rationalisation of limited endoscopy services: the appreciable false-negative rate of FIT in symptomatic patients means most colonoscopies will still be required.",,doi:https://doi.org/10.1136/gutjnl-2020-321650; html:https://europepmc.org/articles/PMC7447105; pdf:https://europepmc.org/articles/PMC7447105?pdf=render
32355555,https://doi.org/10.7189/jogh.10.010104,COVID-19 must catalyse key global natural experiments.,"Been JV, Sheikh A.","Division of Neonatology, Department of Paediatrics, Erasmus MC - Sophia Children's Hospital, University Medical Centre Rotterdam, Rotterdam, Netherlands.; Centre of Medical Informatics, Usher Institute, The University of Edinburgh, Edinburgh, UK.; Centre of Medical Informatics, Usher Institute, The University of Edinburgh, Edinburgh, UK.; Division of General Internal Medicine and Primary Care, Brigham and Women's Hospital/Harvard Medical School, Boston, Massachusetts, USA.",Journal of global health,2020,Y,,,,,"""Been and Sheikh’s editorial about COVID-19, outlines the importance of two natural experiments: a- how different countries responded to the pandemic and its effects and b- impact of improvements in air quality on human and planetary health.""",doi:https://doi.org/10.7189/jogh.10.010104; html:https://europepmc.org/articles/PMC7179980; pdf:https://europepmc.org/articles/PMC7179980?pdf=render
32401709,https://doi.org/10.1016/s2468-2667(20)30112-2,COVID-19: a public health approach to manage domestic violence is needed.,"Chandan JS, Taylor J, Bradbury-Jones C, Nirantharakumar K, Kane E, Bandyopadhyay S.","College of Medical and Dental Sciences, University of Birmingham, Birmingham B15 2TT, UK; Centre for Crime, Justice, and Policing, University of Birmingham, Birmingham B15 2TT, UK. Electronic address: joht.chandan@nhs.net.; College of Medical and Dental Sciences, University of Birmingham, Birmingham B15 2TT, UK; Centre for Crime, Justice, and Policing, University of Birmingham, Birmingham B15 2TT, UK; Institute for Global Innovation, University of Birmingham, Birmingham B15 2TT, UK.; College of Medical and Dental Sciences, University of Birmingham, Birmingham B15 2TT, UK; Centre for Crime, Justice, and Policing, University of Birmingham, Birmingham B15 2TT, UK; Institute for Global Innovation, University of Birmingham, Birmingham B15 2TT, UK.; College of Medical and Dental Sciences, University of Birmingham, Birmingham B15 2TT, UK; Centre for Crime, Justice, and Policing, University of Birmingham, Birmingham B15 2TT, UK; Institute for Global Innovation, University of Birmingham, Birmingham B15 2TT, UK.; Institute for Global Innovation, University of Birmingham, Birmingham B15 2TT, UK; Centre for Health and Justice, University of Nottingham, Nottingham, UK.; Centre for Crime, Justice, and Policing, University of Birmingham, Birmingham B15 2TT, UK; College of Social Sciences, University of Birmingham, Birmingham B15 2TT, UK; Institute for Global Innovation, University of Birmingham, Birmingham B15 2TT, UK.",The Lancet. Public health,2020,Y,,,,,Chandan et al. comment on the effect the covid pandemic may have on domestic violence and propose surveillance for domestic violence is needed. ,doi:https://doi.org/10.1016/S2468-2667(20)30112-2; html:https://europepmc.org/articles/PMC7252171; pdf:https://europepmc.org/articles/PMC7252171?pdf=render
32685697,https://doi.org/10.12688/wellcomeopenres.15788.1,The contribution of pre-symptomatic infection to the transmission dynamics of COVID-2019.,"Liu Y, Centre for Mathematical Modelling of Infectious Diseases nCoV Working Group, Funk S, Flasche S.","Centre for Mathematical Modelling of Infectious Diseases, Department of Infectious Disease Epidemiology, Faculty of Epidemiology and Population Health, London School of Hygiene & Tropical Medicine, London, London, WC1E 7HT, UK.; Centre for Mathematical Modelling of Infectious Diseases, Department of Infectious Disease Epidemiology, Faculty of Epidemiology and Population Health, London School of Hygiene & Tropical Medicine, London, London, WC1E 7HT, UK.; Centre for Mathematical Modelling of Infectious Diseases, Department of Infectious Disease Epidemiology, Faculty of Epidemiology and Population Health, London School of Hygiene & Tropical Medicine, London, London, WC1E 7HT, UK.",Wellcome open research,2020,Y,Incubation period; Serial Interval; Covid-19; Pre-symptomatic Transmission,,,"Background: Pre-symptomatic transmission can be a key determinant of the effectiveness of containment and mitigation strategies for infectious diseases, particularly if interventions rely on syndromic case finding. For COVID-19, infections in the absence of apparent symptoms have been reported frequently alongside circumstantial evidence for asymptomatic or pre-symptomatic transmission. We estimated the potential contribution of pre-symptomatic cases to COVID-19 transmission. Methods: Using the probability for symptom onset on a given day inferred from the incubation period, we attributed the serial interval reported from Shenzen, China, into likely pre-symptomatic and symptomatic transmission. We used the serial interval derived for cases isolated more than 6 days after symptom onset as the no active case finding scenario and the unrestricted serial interval as the active case finding scenario. We reported the estimate assuming no correlation between the incubation period and the serial interval alongside a range indicating alternative assumptions of positive and negative correlation. Results: We estimated that 23% (range accounting for correlation: 12 - 28%) of transmissions in Shenzen may have originated from pre-symptomatic infections. Through accelerated case isolation following symptom onset, this percentage increased to 46% (21 - 46%), implying that about 35% of secondary infections among symptomatic cases have been prevented. These results were robust to using reported incubation periods and serial intervals from other settings. Conclusions: Pre-symptomatic transmission may be essential to consider for containment and mitigation strategies for COVID-19.",,doi:https://doi.org/10.12688/wellcomeopenres.15788.1; html:https://europepmc.org/articles/PMC7324944; pdf:https://europepmc.org/articles/PMC7324944?pdf=render
32553130,https://doi.org/10.1016/s2214-109x(20)30264-3,"Global, regional, and national estimates of the population at increased risk of severe COVID-19 due to underlying health conditions in 2020: a modelling study.","Clark A, Jit M, Warren-Gash C, Guthrie B, Wang HHX, Mercer SW, Sanderson C, McKee M, Troeger C, Ong KL, Checchi F, Perel P, Joseph S, Gibbs HP, Banerjee A, Eggo RM, Centre for the Mathematical Modelling of Infectious Diseases COVID-19 working group.","Department of Health Services Research and Policy, London School of Hygiene & Tropical Medicine, London, UK. Electronic address: andrew.clark@lshtm.ac.uk.; Department of Infectious Disease Epidemiology, London School of Hygiene & Tropical Medicine, London, UK.; Department of Non-Communicable Disease Epidemiology, London School of Hygiene & Tropical Medicine, London, UK.; Centre for Population Health Sciences, Usher Institute, University of Edinburgh, Edinburgh, UK.; School of Public Health, Sun Yat-Sen University, Guangzhou, China.; Centre for Population Health Sciences, Usher Institute, University of Edinburgh, Edinburgh, UK.; Department of Health Services Research and Policy, London School of Hygiene & Tropical Medicine, London, UK.; Department of Health Services Research and Policy, London School of Hygiene & Tropical Medicine, London, UK.; Department for Health Metrics, University of Washington, Seattle, WA, USA.; Institute for Health Metrics and Evaluation, University of Washington, Seattle, WA, USA.; Department of Infectious Disease Epidemiology, London School of Hygiene & Tropical Medicine, London, UK.; Department of Non-Communicable Disease Epidemiology, London School of Hygiene & Tropical Medicine, London, UK.; IAVI Human Immunology Laboratory, Imperial College London, London, UK.; Department of Infectious Disease Epidemiology, London School of Hygiene & Tropical Medicine, London, UK.; Institute of Health Informatics, University College London, London, UK.; Department of Infectious Disease Epidemiology, London School of Hygiene & Tropical Medicine, London, UK.",The Lancet. Global health,2020,Y,,,,"BACKGROUND:The risk of severe COVID-19 if an individual becomes infected is known to be higher in older individuals and those with underlying health conditions. Understanding the number of individuals at increased risk of severe COVID-19 and how this varies between countries should inform the design of possible strategies to shield or vaccinate those at highest risk. METHODS:We estimated the number of individuals at increased risk of severe disease (defined as those with at least one condition listed as ""at increased risk of severe COVID-19"" in current guidelines) by age (5-year age groups), sex, and country for 188 countries using prevalence data from the Global Burden of Diseases, Injuries, and Risk Factors Study (GBD) 2017 and UN population estimates for 2020. The list of underlying conditions relevant to COVID-19 was determined by mapping the conditions listed in GBD 2017 to those listed in guidelines published by WHO and public health agencies in the UK and the USA. We analysed data from two large multimorbidity studies to determine appropriate adjustment factors for clustering and multimorbidity. To help interpretation of the degree of risk among those at increased risk, we also estimated the number of individuals at high risk (defined as those that would require hospital admission if infected) using age-specific infection-hospitalisation ratios for COVID-19 estimated for mainland China and making adjustments to reflect country-specific differences in the prevalence of underlying conditions and frailty. We assumed males were twice at likely as females to be at high risk. We also calculated the number of individuals without an underlying condition that could be considered at increased risk because of their age, using minimum ages from 50 to 70 years. We generated uncertainty intervals (UIs) for our estimates by running low and high scenarios using the lower and upper 95% confidence limits for country population size, disease prevalences, multimorbidity fractions, and infection-hospitalisation ratios, and plausible low and high estimates for the degree of clustering, informed by multimorbidity studies. FINDINGS:We estimated that 1·7 billion (UI 1·0-2·4) people, comprising 22% (UI 15-28) of the global population, have at least one underlying condition that puts them at increased risk of severe COVID-19 if infected (ranging from <5% of those younger than 20 years to >66% of those aged 70 years or older). We estimated that 349 million (186-787) people (4% [3-9] of the global population) are at high risk of severe COVID-19 and would require hospital admission if infected (ranging from <1% of those younger than 20 years to approximately 20% of those aged 70 years or older). We estimated 6% (3-12) of males to be at high risk compared with 3% (2-7) of females. The share of the population at increased risk was highest in countries with older populations, African countries with high HIV/AIDS prevalence, and small island nations with high diabetes prevalence. Estimates of the number of individuals at increased risk were most sensitive to the prevalence of chronic kidney disease, diabetes, cardiovascular disease, and chronic respiratory disease. INTERPRETATION:About one in five individuals worldwide could be at increased risk of severe COVID-19, should they become infected, due to underlying health conditions, but this risk varies considerably by age. Our estimates are uncertain, and focus on underlying conditions rather than other risk factors such as ethnicity, socioeconomic deprivation, and obesity, but provide a starting point for considering the number of individuals that might need to be shielded or vaccinated as the global pandemic unfolds. FUNDING:UK Department for International Development, Wellcome Trust, Health Data Research UK, Medical Research Council, and National Institute for Health Research.",,doi:https://doi.org/10.1016/S2214-109X(20)30264-3; html:https://europepmc.org/articles/PMC7295519
