id,doi,title,authorString,authorAffiliations,journalTitle,pubYear,isOpenAccess,keywords,nationalPriorities,healthCategories,abstract,laySummary,urls
32565483,https://doi.org/10.1136/bmjopen-2020-039097,Early Pandemic Evaluation and Enhanced Surveillance of COVID-19 (EAVE II): protocol for an observational study using linked Scottish national data.,"Simpson CR, Robertson C, Vasileiou E, McMenamin J, Gunson R, Ritchie LD, Woolhouse M, Morrice L, Kelly D, Stagg HR, Marques D, Murray J, Sheikh A.","Wellington School of Health, Faculty of Health, Victoria University of Wellington, Wellington, New Zealand.; Usher Institute, The University of Edinburgh, Edinburgh, UK.; Department of Mathematics and Statistics, University of Strathclyde, Glasgow, UK.; Public Health Scotland, Glasgow, UK.; Usher Institute, The University of Edinburgh, Edinburgh, UK eleftheria.vasileiou@ed.ac.uk.; Public Health Scotland, Glasgow, UK.; West Of Scotland Specialist Virology Centre, Glasgow, UK.; Centre of Academic Primary Care, University of Aberdeen, Aberdeen, UK.; Usher Institute, The University of Edinburgh, Edinburgh, UK.; Usher Institute, The University of Edinburgh, Edinburgh, UK.; The Centre for Health Science, Albasoft Ltd, Inverness, UK.; Usher Institute, The University of Edinburgh, Edinburgh, UK.; Public Health Scotland, Glasgow, UK.; Public Health Scotland, Glasgow, UK.; Usher Institute, The University of Edinburgh, Edinburgh, UK.",BMJ open,2020,Y,epidemiology; Public Health; Respiratory Medicine (See Thoracic Medicine),,,"INTRODUCTION:Following the emergence of the novel severe acute respiratory syndrome coronavirus 2 (SARS-CoV-2) in December 2019 and the ensuing COVID-19 pandemic, population-level surveillance and rapid assessment of the effectiveness of existing or new therapeutic or preventive interventions are required to ensure that interventions are targeted to those at highest risk of serious illness or death from COVID-19. We aim to repurpose and expand an existing pandemic reporting platform to determine the attack rate of SARS-CoV-2, the uptake and effectiveness of any new pandemic vaccine (once available) and any protective effect conferred by existing or new antimicrobial drugs and other therapies. METHODS AND ANALYSIS:A prospective observational cohort will be used to monitor daily/weekly the progress of the COVID-19 epidemic and to evaluate the effectiveness of therapeutic interventions in approximately 5.4 million individuals registered in general practices across Scotland. A national linked dataset of patient-level primary care data, out-of-hours, hospitalisation, mortality and laboratory data will be assembled. The primary outcomes will measure association between: (A) laboratory confirmed SARS-CoV-2 infection, morbidity and mortality, and demographic, socioeconomic and clinical population characteristics; and (B) healthcare burden of COVID-19 and demographic, socioeconomic and clinical population characteristics. The secondary outcomes will estimate: (A) the uptake (for vaccines only); (B) effectiveness; and (C) safety of new or existing therapies, vaccines and antimicrobials against SARS-CoV-2 infection. The association between population characteristics and primary outcomes will be assessed via multivariate logistic regression models. The effectiveness of therapies, vaccines and antimicrobials will be assessed from time-dependent Cox models or Poisson regression models. Self-controlled study designs will be explored to estimate the risk of therapeutic and prophylactic-related adverse events. ETHICS AND DISSEMINATION:We obtained approval from the National Research Ethics Service Committee, Southeast Scotland 02. The study findings will be presented at international conferences and published in peer-reviewed journals.",,doi:https://doi.org/10.1136/bmjopen-2020-039097; html:https://europepmc.org/articles/PMC7311023; pdf:https://europepmc.org/articles/PMC7311023?pdf=render
PMC7201389,https://doi.org/,Modelling COVID-19,"Vespignani A, Tian H, Dye C, Lloyd-Smith J, Eggo R, Shrestha M, Scarpino S, Gutierrez B, Kraemer M, Wu J, Leung K, Leung G.","2 Turin, Italy; 3 Beijing, China; 4 Oxford, UK; 5 Los Angeles, CA USA; 6 London, UK; 1 Boston, MA USA; 1 Boston, MA USA; 7 Quito, Ecuador; 9 Boston, MA USA; 10 Hong Kong SAR, China; 10 Hong Kong SAR, China; 10 Hong Kong SAR, China",Nature Reviews Physics,2020,Y,Applied Mathematics; Complex Networks,,,"As the COVID-19 pandemic continues, mathematical epidemiologists share their views on what models reveal about how the disease has spread, the current state of play and what work still needs to be done. As the COVID-19 pandemic continues, mathematical epidemiologists share their views on what models reveal about how the disease has spread, the current state of play and what work still needs to be done. The contributors Alessandro Vespignani is an Italian-American physicist, currently Sternberg Family Distinguished University Professor of Physics, Computer Science and Health Sciences at Northeastern University in Boston, USA. He is the director of the Network Science Institute, and is best known for his work on complex networks and his contributions to computational epidemiology by developing specific tools for analysing the global spread of epidemics. Huaiyu Tian is a Professor of Ecology and Evolution of Infectious Disease at Beijing Normal University, China, and Oxford Martin Visiting Fellow at the University of Oxford. His interdisciplinary research focuses on the mechanistic processes that link biological and ecological change to disease dynamics. His lab combines geospatial computing, field surveillance, molecular epidemiology and ecological modelling. Christopher Dye is a Visiting Professor of Zoology and Oxford Martin Visiting Fellow at the University of Oxford. He is a former Director of Strategy at the World Health Organization, and is currently editor of coronavirusexplained.ukri.org/en/, a website that explains the science of coronavirus outbreaks, hosted by UK Research and Innovation (UKRI). James O. Lloyd-Smith is a professor in the Department of Ecology and Evolutionary Biology at the University of California, Los Angeles. His research explores the ecological and evolutionary dynamics of infectious disease in animal and human populations, with emphasis on the emergence of novel pathogens. His group combines mathematical models, statistical analysis, and laboratory, clinical and field studies to study diseases such as monkeypox, leptospirosis, influenza and now COVID-19. Rosalind M. Eggo is a mathematical modeller focusing on directly transmitted viral pathogens and the severe outcomes resulting from infection. She works at the London School of Hygiene and Tropical Medicine. Munik Shrestha is a postdoctoral researcher at Northeastern University in the Network Science Institute. He has contributed fundamental theory on message-passing algorithms for estimating the time-varying statistics of epidemics. He received his Ph.D. in physics from the University of New Mexico and was a Santa Fe Institute graduate fellow. Samuel V. Scarpino is an assistant professor in the Network Science Institute at Northeastern University, with appointments in marine and environmental sciences, physics, and health sciences. He is also an ISI Foundation complexity fellow. Scarpino earned a Ph.D. in evolution, ecology and behaviour from the University of Texas at Austin and was a Santa Fe Institute Omidyar postdoctoral fellow. Bernardo Gutierrez is a D.Phil. student in the Department of Zoology at the University of Oxford, and a guest researcher at Universidad San Francisco de Quito. He studies the evolution of emerging viruses and the integration of epidemiological and genomic data to track outbreaks. He began contributing to the Open COVID-19 Data Working Group during the start of the SARS-CoV-2 epidemic in January 2020. Moritz U. G. Kraemer is a research fellow at the University of Oxford and founder of the Open COVID-19 Data Working Group. Moritz is an epidemiologist working on the integration of multiple data streams to better understand the dynamics of emerging infectious diseases. Joseph Wu is a professor in the School of Public Health at the University of Hong Kong. He specializes in disease modelling and data science. Kathy Leung is an infectious disease epidemiologist at the University of Hong Kong. She specializes in mathematical modelling of communicable and non-communicable diseases, including COVID-19, influenza, Middle East respiratory syndrome, human papillomavirus, colorectal cancer and breast cancer. Gabriel M. Leung is an infectious disease epidemiologist, Dean of Medicine and Zimmern Professor of Population Health at the University of Hong Kong.",,html:https://www.ncbi.nlm.nih.gov/pmc/articles/PMC7201389/?tool=EBI; pdf:https://www.ncbi.nlm.nih.gov/pmc/articles/PMC7201389/pdf/?tool=EBI; html:https://europepmc.org/articles/PMC7201389; pdf:https://europepmc.org/articles/PMC7201389?pdf=render
32873607,https://doi.org/10.1136/bmjresp-2020-000644,Ethnicity and risk of death in patients hospitalised for COVID-19 infection in the UK: an observational cohort study in an urban catchment area.,"Sapey E, Gallier S, Mainey C, Nightingale P, McNulty D, Crothers H, Evison F, Reeves K, Pagano D, Denniston AK, Nirantharakumar K, Diggle P, Ball S, All clinicians and students at University Hospitals Birmingham NHS Foundation Trust.","PIONEER HDR-UK Hub, University of Birmingham, Birmingham, West Midlands, UK e.sapey@bham.ac.uk.; Acute Medicine, University Hospitals Birmingham NHS Foundation Trust, Birmingham, UK.; PIONEER Technical Director, Health Informatics, University Hospitals Birmingham NHS Foundation Trust, Birmingham, UK.; Health Informatics, University Hospitals Birmingham NHS Foundation Trust, Birmingham, UK.; Statistics, University Hospitals Birmingham NHS Foundation Trust, Birmingham, UK.; Health Informatics, University Hospitals Birmingham NHS Foundation Trust, Birmingham, UK.; Health Informatics, University Hospitals Birmingham NHS Foundation Trust, Birmingham, UK.; Department of Informatics, University Hospitals Birmingham NHS Foundation Trust, Birmingham, UK.; Health Informatics, University Hospitals Birmingham NHS Foundation Trust, Birmingham, UK.; Cardiothoracic Surgery, University Hospitals Birmingham, Birmingham, UK.; INSIGHT: HDRUK Health Data Research Hub for Eye Health, University Hospitals Birmingham NHS Foundation Trust, Birmingham, UK.; Public Health, University of Birmingham, Birmingham, UK.; Faculty of Health and Medicine, Lancaster University, Lancaster, Lancashire, UK.; Epidemiology and Population Health, University of Liverpool, Liverpool, Merseyside, UK.; HDR-UK Midlands Physical Site, University Hospitals Birmingham, Birmingham, UK.",BMJ open respiratory research,2020,Y,Viral infection; respiratory infection; Clinical Epidemiology,,,"BACKGROUND:Studies suggest that certain black and Asian minority ethnic groups experience poorer outcomes from COVID-19, but these studies have not provided insight into potential reasons for this. We hypothesised that outcomes would be poorer for those of South Asian ethnicity hospitalised from a confirmed SARS-CoV-2 infection, once confounding factors, health-seeking behaviours and community demographics were considered, and that this might reflect a more aggressive disease course in these patients. METHODS:Patients with confirmed SARS-CoV-2 infection requiring admission to University Hospitals Birmingham NHS Foundation Trust (UHB) in Birmingham, UK between 10 March 2020 and 17 April 2020 were included. Standardised admission ratio (SAR) and standardised mortality ratio (SMR) were calculated using observed COVID-19 admissions/deaths and 2011 census data. Adjusted HR for mortality was estimated using Cox proportional hazard model adjusting and propensity score matching. RESULTS:All patients admitted to UHB with COVID-19 during the study period were included (2217 in total). 58% were male, 69.5% were white and the majority (80.2%) had comorbidities. 18.5% were of South Asian ethnicity, and these patients were more likely to be younger and have no comorbidities, but twice the prevalence of diabetes than white patients. SAR and SMR suggested more admissions and deaths in South Asian patients than would be predicted and they were more likely to present with severe disease despite no delay in presentation since symptom onset. South Asian ethnicity was associated with an increased risk of death, both by Cox regression (HR 1.4, 95% CI 1.2 to 1.8), after adjusting for age, sex, deprivation and comorbidities, and by propensity score matching, matching for the same factors but categorising ethnicity into South Asian or not (HR 1.3, 95% CI 1.0 to 1.6). CONCLUSIONS:Those of South Asian ethnicity appear at risk of worse COVID-19 outcomes. Further studies need to establish the underlying mechanistic pathways.",,doi:https://doi.org/10.1136/bmjresp-2020-000644; html:https://europepmc.org/articles/PMC7467523; pdf:https://europepmc.org/articles/PMC7467523?pdf=render
32735547,https://doi.org/10.2196/20169,Can Robots Improve Testing Capacity for SARS-CoV-2?,"Cresswell K, Ramalingam S, Sheikh A.","The University of Edinburgh, Edinburgh, United Kingdom.; The University of Edinburgh, Edinburgh, United Kingdom.; The University of Edinburgh, Edinburgh, United Kingdom.",Journal of medical Internet research,2020,Y,Virus; Infectious disease; Testing; Robotics; Pandemic; Covid-19; Sars-cov-2,,,"There is currently increasing interest internationally in deploying robotic applications for severe acute respiratory syndrome coronavirus 2 (SARS-CoV-2) testing, as these can help to reduce the risk of transmission of the virus to health care staff and patients. We provide an overview of key recent developments in this area. We argue that, although there is some potential for deploying robots to help with SARS-CoV-2 testing, the potential of patient-facing applications is likely to be limited. This is due to the high costs associated with patient-facing functionality, and risks of potentially adverse impacts on health care staff work practices and patient interactions. In contrast, back-end laboratory-based robots dealing with sample extraction and amplification, that effectively integrate with established processes, software, and interfaces to process samples, are much more likely to result in safety and efficiency gains. Consideration should therefore be given to deploying these at scale.",,doi:https://doi.org/10.2196/20169; html:https://europepmc.org/articles/PMC7450371
32485082,https://doi.org/10.1002/ejhf.1924,Angiotensin-converting enzyme inhibitors and angiotensin II receptor blockers are not associated with severe COVID-19 infection in a multi-site UK acute hospital trust.,"Bean DM, Kraljevic Z, Searle T, Bendayan R, Kevin O, Pickles A, Folarin A, Roguski L, Noor K, Shek A, Zakeri R, Shah AM, Teo JTH, Dobson RJB.","Department of Biostatistics and Health Informatics, Institute of Psychiatry, Psychology and Neuroscience, King's College London, London, UK.; Health Data Research UK London, University College London, London, UK.; Department of Biostatistics and Health Informatics, Institute of Psychiatry, Psychology and Neuroscience, King's College London, London, UK.; Department of Biostatistics and Health Informatics, Institute of Psychiatry, Psychology and Neuroscience, King's College London, London, UK.; Department of Biostatistics and Health Informatics, Institute of Psychiatry, Psychology and Neuroscience, King's College London, London, UK.; NIHR Biomedical Research Centre at South London and Maudsley NHS Foundation Trust and King's College London, London, UK.; King's College Hospital NHS Foundation Trust, London, UK.; School of Cardiovascular Medicine & Sciences, King's College London British Heart Foundation Centre of Excellence, London, UK.; Department of Biostatistics and Health Informatics, Institute of Psychiatry, Psychology and Neuroscience, King's College London, London, UK.; Department of Biostatistics and Health Informatics, Institute of Psychiatry, Psychology and Neuroscience, King's College London, London, UK.; Health Data Research UK London, University College London, London, UK.; Institute of Health Informatics, University College London, London, UK.; NIHR Biomedical Research Centre, University College London Hospitals NHS Foundation Trust, London, UK.; Health Data Research UK London, University College London, London, UK.; Institute of Health Informatics, University College London, London, UK.; NIHR Biomedical Research Centre, University College London Hospitals NHS Foundation Trust, London, UK.; Health Data Research UK London, University College London, London, UK.; Institute of Health Informatics, University College London, London, UK.; NIHR Biomedical Research Centre, University College London Hospitals NHS Foundation Trust, London, UK.; Department of Clinical Neuroscience, Institute of Psychiatry, Psychology and Neuroscience, King's College London, London, UK.; King's College Hospital NHS Foundation Trust, London, UK.; School of Cardiovascular Medicine & Sciences, King's College London British Heart Foundation Centre of Excellence, London, UK.; King's College Hospital NHS Foundation Trust, London, UK.; School of Cardiovascular Medicine & Sciences, King's College London British Heart Foundation Centre of Excellence, London, UK.; King's College Hospital NHS Foundation Trust, London, UK.; Department of Clinical Neuroscience, Institute of Psychiatry, Psychology and Neuroscience, King's College London, London, UK.; Department of Biostatistics and Health Informatics, Institute of Psychiatry, Psychology and Neuroscience, King's College London, London, UK.; Health Data Research UK London, University College London, London, UK.; NIHR Biomedical Research Centre at South London and Maudsley NHS Foundation Trust and King's College London, London, UK.; Institute of Health Informatics, University College London, London, UK.; NIHR Biomedical Research Centre, University College London Hospitals NHS Foundation Trust, London, UK.",European journal of heart failure,2020,Y,Hypertension; Angiotensin-converting enzyme inhibitors; Disease Outcome; Covid-19,,,"AIMS:The SARS-CoV-2 virus binds to the angiotensin-converting enzyme 2 (ACE2) receptor for cell entry. It has been suggested that angiotensin-converting enzyme inhibitors (ACEi) and angiotensin II receptor blockers (ARB), which are commonly used in patients with hypertension or diabetes and may raise tissue ACE2 levels, could increase the risk of severe COVID-19 infection. METHODS AND RESULTS:We evaluated this hypothesis in a consecutive cohort of 1200 acute inpatients with COVID-19 at two hospitals with a multi-ethnic catchment population in London (UK). The mean age was 68 ± 17 years (57% male) and 74% of patients had at least one comorbidity. Overall, 415 patients (34.6%) reached the primary endpoint of death or transfer to a critical care unit for organ support within 21 days of symptom onset. A total of 399 patients (33.3%) were taking ACEi or ARB. Patients on ACEi/ARB were significantly older and had more comorbidities. The odds ratio for the primary endpoint in patients on ACEi and ARB, after adjustment for age, sex and co-morbidities, was 0.63 (95% confidence interval 0.47-0.84, P < 0.01). CONCLUSIONS:There was no evidence for increased severity of COVID-19 in hospitalised patients on chronic treatment with ACEi or ARB. A trend towards a beneficial effect of ACEi/ARB requires further evaluation in larger meta-analyses and randomised clinical trials.","This study aimed to determine whether or not two specific types of medication (ACE inhibitors and angiotensin-2 blockers - ACEi/ARB) used for hypertension or diabetes are associated with increased risk of severe COVID-19 infection in a sample of 1,200 inpatients (one third of whom were taking the medications under investigation) in two London hospitals. The researchers used data from electonic medical notes and electronic health records. The patients who were taking the medication were, on average, older and had more underlying health conditions than patients who were not. After accounting for these differences in patient health the researchers found that the risk of severe COVID infection was not higher for patients taking ACEi/ARB. This finding is important for patients because it suggests that they should continue to take ACEi/ARB that have been presecribed to them.",doi:https://doi.org/10.1002/ejhf.1924; html:https://europepmc.org/articles/PMC7301045; pdf:https://europepmc.org/articles/PMC7301045?pdf=render
32564639,https://doi.org/10.1177/0300060520931298,Mortality statistics in England and Wales: the SARS-CoV-2 paradox.,"Harrison G, Newport D, Robbins T, Arvanitis TN, Stein A.","Warwick Medical School, University of Warwick, Coventry, UK.; University Hospitals Coventry & Warwickshire, NHS Trust, Coventry, UK.; Warwick Medical School, University of Warwick, Coventry, UK.; University Hospitals Coventry & Warwickshire, NHS Trust, Coventry, UK.; University Hospitals Coventry & Warwickshire, NHS Trust, Coventry, UK.; Institute of Digital Healthcare, WMG, University of Warwick, Coventry, UK.; Institute of Digital Healthcare, WMG, University of Warwick, Coventry, UK.; University Hospitals Coventry & Warwickshire, NHS Trust, Coventry, UK.",The Journal of international medical research,2020,Y,Respiratory disease; United Kingdom; Mortality Rate; Paradox; Covid-19; Sars-cov-2,,,"OBJECTIVE:To analyse mortality statistics in the United Kingdom during the initial phases of the severe acute respiratory coronavirus 2 (SARS-CoV-2) pandemic and to understand the impact of the pandemic on national mortality. METHODS:Retrospective review of weekly national mortality statistics in the United Kingdom over the past 5 years, including subgroup analysis of respiratory mortality rates. RESULTS:During the early phases of the SARS-CoV-2 pandemic in the first months of 2020, there were consistently fewer deaths per week compared with the preceding 5 years. This pattern was not observed at any other time within the past 5 years. We have termed this phenomenon the ""SARS-CoV-2 paradox."" We postulate potential explanations for this seeming paradox and explore the implications of these data. CONCLUSIONS:Paradoxically, but potentially importantly, lower rather than higher weekly mortality rates were observed during the early stages of the SARS-CoV-2 pandemic. This paradox may have implications for current and future healthcare utilisation. A rebound increase in non-SARS-CoV-2 mortality later this year might coincide with the peak of SARS-CoV-2 admissions and mortality.",,doi:https://doi.org/10.1177/0300060520931298; html:https://europepmc.org/articles/PMC7307394; pdf:https://europepmc.org/articles/PMC7307394?pdf=render
