id,doi,title,authorString,authorAffiliations,journalTitle,pubYear,isOpenAccess,keywords,nationalPriorities,healthCategories,abstract,laySummary,urls
32371477,https://doi.org/10.1126/science.abc0473,Rapid implementation of mobile technology for real-time epidemiology of COVID-19.,"Drew DA, Nguyen LH, Steves CJ, Menni C, Freydin M, Varsavsky T, Sudre CH, Cardoso MJ, Ourselin S, Wolf J, Spector TD, Chan AT, COPE Consortium.","Clinical and Translational Epidemiology Unit, Massachusetts General Hospital and Harvard Medical School, 55 Fruit St., Boston, MA 02114, USA.; Clinical and Translational Epidemiology Unit, Massachusetts General Hospital and Harvard Medical School, 55 Fruit St., Boston, MA 02114, USA.; Department of Twin Research and Genetic Epidemiology, King's College London, Westminster Bridge Road, London SE1 7EH, UK.; Department of Ageing and Health, Guys and St. Thomas' NHS Foundation Trust, Lambeth Palace Road, London SE1 7EH, UK.; Department of Twin Research and Genetic Epidemiology, King's College London, Westminster Bridge Road, London SE1 7EH, UK.; Department of Twin Research and Genetic Epidemiology, King's College London, Westminster Bridge Road, London SE1 7EH, UK.; School of Biomedical Engineering & Imaging Sciences, King's College London, 1 Lambeth Palace Road, London SE1 7EU, UK.; School of Biomedical Engineering & Imaging Sciences, King's College London, 1 Lambeth Palace Road, London SE1 7EU, UK.; School of Biomedical Engineering & Imaging Sciences, King's College London, 1 Lambeth Palace Road, London SE1 7EU, UK.; School of Biomedical Engineering & Imaging Sciences, King's College London, 1 Lambeth Palace Road, London SE1 7EU, UK.; Zoe Global Limited, 164 Westminster Bridge Road, London SE1 7RW, UK.; Department of Twin Research and Genetic Epidemiology, King's College London, Westminster Bridge Road, London SE1 7EH, UK.; Zoe Global Limited, 164 Westminster Bridge Road, London SE1 7RW, UK.; Clinical and Translational Epidemiology Unit, Massachusetts General Hospital and Harvard Medical School, 55 Fruit St., Boston, MA 02114, USA. achan@mgh.harvard.edu.; Department of Immunology and Infectious Diseases, Harvard T.H. Chan School of Public Health, 665 Huntington Ave., Boston, MA 02114, USA.","Science (New York, N.Y.)",2020,Y,,,,"The rapid pace of the coronavirus disease 2019 (COVID-19) pandemic caused by severe acute respiratory syndrome coronavirus 2 (SARS-CoV-2) presents challenges to the robust collection of population-scale data to address this global health crisis. We established the COronavirus Pandemic Epidemiology (COPE) Consortium to unite scientists with expertise in big data research and epidemiology to develop the COVID Symptom Study, previously known as the COVID Symptom Tracker, mobile application. This application-which offers data on risk factors, predictive symptoms, clinical outcomes, and geographical hotspots-was launched in the United Kingdom on 24 March 2020 and the United States on 29 March 2020 and has garnered more than 2.8 million users as of 2 May 2020. Our initiative offers a proof of concept for the repurposing of existing approaches to enable rapidly scalable epidemiologic data collection and analysis, which is critical for a data-driven response to this public health challenge.","Drew et al. decribe the use of a smart-phone App to track Covid-19 symptoms reported by users to track, in real time, information on newly infected individuals. It has been launched in the UK and US and has 2.8 million users and is used to rapidly identify emerging hot spots for infection.",doi:https://doi.org/10.1126/science.abc0473; html:https://europepmc.org/articles/PMC7200009; pdf:https://europepmc.org/articles/PMC7200009?pdf=render
32426117,https://doi.org/10.7189/jogh.10.010348,Novel approaches to estimate compliance with lockdown measures in the COVID-19 pandemic.,"Sheikh A, Sheikh Z, Sheikh A.","Medical student, University of Edinburgh, Edinburgh, UK.; Medical student, University of Edinburgh, Edinburgh, UK.; Usher Institute, University of Edinburgh, Edinburgh, UK.",Journal of global health,2020,Y,,,,,This is a summary of new methods for estimating phyiscal distancing and compliance with lockdown. I haven't scored the content because it isn't primary research.,doi:https://doi.org/10.7189/jogh.10.010348; html:https://europepmc.org/articles/PMC7211415; pdf:https://europepmc.org/articles/PMC7211415?pdf=render
32878619,https://doi.org/10.1186/s12916-020-01726-3,COVID-19 length of hospital stay: a systematic review and data synthesis.,"Rees EM, Nightingale ES, Jafari Y, Waterlow NR, Clifford S, B Pearson CA, Group CW, Jombart T, Procter SR, Knight GM.","Department of Infectious Disease Epidemiology, London School of Hygiene and Tropical Medicine, Keppel Street, London, UK. eleanor.rees1@lshtm.ac.uk.; Department of Global Health and Development, London School of Hygiene and Tropical Medicine, Keppel Street, London, UK.; Department of Infectious Disease Epidemiology, London School of Hygiene and Tropical Medicine, Keppel Street, London, UK.; Department of Infectious Disease Epidemiology, London School of Hygiene and Tropical Medicine, Keppel Street, London, UK.; Department of Infectious Disease Epidemiology, London School of Hygiene and Tropical Medicine, Keppel Street, London, UK.; Department of Infectious Disease Epidemiology, London School of Hygiene and Tropical Medicine, Keppel Street, London, UK.; South African DSI-NRF Centre of Excellence in Epidemiological Modelling and Analysis (SACEMA), Stellenbosch University, Stellenbosch, Republic of South Africa.; Department of Infectious Disease Epidemiology, London School of Hygiene and Tropical Medicine, Keppel Street, London, UK.; Department of Infectious Disease Epidemiology, London School of Hygiene and Tropical Medicine, Keppel Street, London, UK.; UK Public Health Rapid Support Team, London, UK.; MRC Centre for Global Infectious Disease Analysis, Department of Infectious Disease Epidemiology, School of Public Health, Imperial College, London, UK.; Department of Infectious Disease Epidemiology, London School of Hygiene and Tropical Medicine, Keppel Street, London, UK.; Department of Infectious Disease Epidemiology, London School of Hygiene and Tropical Medicine, Keppel Street, London, UK.",BMC medicine,2020,Y,Length Of Stay; Hospitalisation; Icu Capacity; Covid-19; Sars-cov-2; Bed Demand,,,"BACKGROUND:The COVID-19 pandemic has placed an unprecedented strain on health systems, with rapidly increasing demand for healthcare in hospitals and intensive care units (ICUs) worldwide. As the pandemic escalates, determining the resulting needs for healthcare resources (beds, staff, equipment) has become a key priority for many countries. Projecting future demand requires estimates of how long patients with COVID-19 need different levels of hospital care. METHODS:We performed a systematic review of early evidence on length of stay (LoS) of patients with COVID-19 in hospital and in ICU. We subsequently developed a method to generate LoS distributions which combines summary statistics reported in multiple studies, accounting for differences in sample sizes. Applying this approach, we provide distributions for total hospital and ICU LoS from studies in China and elsewhere, for use by the community. RESULTS:We identified 52 studies, the majority from China (46/52). Median hospital LoS ranged from 4 to 53 days within China, and 4 to 21 days outside of China, across 45 studies. ICU LoS was reported by eight studies-four each within and outside China-with median values ranging from 6 to 12 and 4 to 19 days, respectively. Our summary distributions have a median hospital LoS of 14 (IQR 10-19) days for China, compared with 5 (IQR 3-9) days outside of China. For ICU, the summary distributions are more similar (median (IQR) of 8 (5-13) days for China and 7 (4-11) days outside of China). There was a visible difference by discharge status, with patients who were discharged alive having longer LoS than those who died during their admission, but no trend associated with study date. CONCLUSION:Patients with COVID-19 in China appeared to remain in hospital for longer than elsewhere. This may be explained by differences in criteria for admission and discharge between countries, and different timing within the pandemic. In the absence of local data, the combined summary LoS distributions provided here can be used to model bed demands for contingency planning and then updated, with the novel method presented here, as more studies with aggregated statistics emerge outside China.",,doi:https://doi.org/10.1186/s12916-020-01726-3; html:https://europepmc.org/articles/PMC7467845; pdf:https://europepmc.org/articles/PMC7467845?pdf=render
32835195,https://doi.org/10.1016/s2589-7500(20)30134-5,The effects of physical distancing on population mobility during the COVID-19 pandemic in the UK.,"Drake TM, Docherty AB, Weiser TG, Yule S, Sheikh A, Harrison EM.","Centre for Medical Informatics, Usher Institute, University of Edinburgh, Edinburgh, EH16 4UX, UK.; Centre for Medical Informatics, Usher Institute, University of Edinburgh, Edinburgh, EH16 4UX, UK.; Department of Clinical Surgery, University of Edinburgh, Edinburgh, EH16 4UX, UK.; Department of Surgery, Stanford University, Stanford, CA, USA.; Department of Clinical Surgery, University of Edinburgh, Edinburgh, EH16 4UX, UK.; Department of Surgery, Brigham & Women's Hospital, Harvard Medical School, Boston, MA 02115, USA.; Centre for Medical Informatics, Usher Institute, University of Edinburgh, Edinburgh, EH16 4UX, UK.; Centre for Medical Informatics, Usher Institute, University of Edinburgh, Edinburgh, EH16 4UX, UK.",The Lancet. Digital health,2020,Y,,,,,,doi:https://doi.org/10.1016/S2589-7500(20)30134-5; html:https://europepmc.org/articles/PMC7292602; pdf:https://europepmc.org/articles/PMC7292602?pdf=render
32685698,https://doi.org/10.12688/wellcomeopenres.15842.2,Estimating the overdispersion in COVID-19 transmission using outbreak sizes outside China. ,"Endo A, Centre for the Mathematical Modelling of Infectious Diseases COVID-19 Working Group, Abbott S, Kucharski AJ, Funk S.","Department of Infectious Disease Epidemiology, London School of Hygiene & Tropical Medicine, London, WC1E 7HT, UK.; The Alan Turing Institute, London, NW1 2DB, UK.; Department of Infectious Disease Epidemiology, London School of Hygiene & Tropical Medicine, London, WC1E 7HT, UK.; Centre for the Mathematical Modelling of Infectious Diseases, London School of Hygiene & Tropical Medicine, London, WC1E 7HT, UK.; Department of Infectious Disease Epidemiology, London School of Hygiene & Tropical Medicine, London, WC1E 7HT, UK.; Centre for the Mathematical Modelling of Infectious Diseases, London School of Hygiene & Tropical Medicine, London, WC1E 7HT, UK.; Department of Infectious Disease Epidemiology, London School of Hygiene & Tropical Medicine, London, WC1E 7HT, UK.; Centre for the Mathematical Modelling of Infectious Diseases, London School of Hygiene & Tropical Medicine, London, WC1E 7HT, UK.",Wellcome open research,2020,Y,,,,"Background: A novel coronavirus disease (COVID-19) outbreak has now spread to a number of countries worldwide. While sustained transmission chains of human-to-human transmission suggest high basic reproduction number R0, variation in the number of secondary transmissions (often characterised by so-called superspreading events) may be large as some countries have observed fewer local transmissions than others. Methods: We quantified individual-level variation in COVID-19 transmission by applying a mathematical model to observed outbreak sizes in affected countries. We extracted the number of imported and local cases in the affected countries from the World Health Organization situation report and applied a branching process model where the number of secondary transmissions was assumed to follow a negative-binomial distribution. Results: Our model suggested a high degree of individual-level variation in the transmission of COVID-19. Within the current consensus range of R0 (2-3), the overdispersion parameter k of a negative-binomial distribution was estimated to be around 0.1 (median estimate 0.1; 95% CrI: 0.05-0.2 for R0 = 2.5), suggesting that 80% of secondary transmissions may have been caused by a small fraction of infectious individuals (~10%). A joint estimation yielded likely ranges for R0 and k (95% CrIs: R0 1.4-12; k 0.04-0.2); however, the upper bound of R0 was not well informed by the model and data, which did not notably differ from that of the prior distribution. Conclusions: Our finding of a highly-overdispersed offspring distribution highlights a potential benefit to focusing intervention efforts on superspreading. As most infected individuals do not contribute to the expansion of an epidemic, the effective reproduction number could be drastically reduced by preventing relatively rare superspreading events.",,doi:https://doi.org/10.12688/wellcomeopenres.15842.2; html:https://europepmc.org/articles/PMC7338915; pdf:https://europepmc.org/articles/PMC7338915?pdf=render
32400358,https://doi.org/10.2807/1560-7917.es.2020.25.18.2000632,"Estimating number of cases and spread of coronavirus disease (COVID-19) using critical care admissions, United Kingdom, February to March 2020.","Jit M, Jombart T, Nightingale ES, Endo A, Abbott S, LSHTM Centre for Mathematical Modelling of Infectious Diseases COVID-19 Working Group, Edmunds WJ.","School of Public Health, Li Ka Shing Faculty of Medicine, University of Hong Kong, Hong Kong SAR, China.; Centre for Mathematical Modelling of Infectious Diseases, Department of Infectious Disease Epidemiology, London School of Hygiene and Tropical Medicine, London, United Kingdom.; MRC Centre for Global Infectious Disease Analysis, Department of Infectious Disease Epidemiology, School of Public Health, Imperial College London, United Kingdom.; United Kingdom Public Health Rapid Support Team, London, United Kingdom.; Centre for Mathematical Modelling of Infectious Diseases, Department of Infectious Disease Epidemiology, London School of Hygiene and Tropical Medicine, London, United Kingdom.; Centre for Mathematical Modelling of Infectious Diseases, Department of Infectious Disease Epidemiology, London School of Hygiene and Tropical Medicine, London, United Kingdom.; Centre for Mathematical Modelling of Infectious Diseases, Department of Infectious Disease Epidemiology, London School of Hygiene and Tropical Medicine, London, United Kingdom.; Centre for Mathematical Modelling of Infectious Diseases, Department of Infectious Disease Epidemiology, London School of Hygiene and Tropical Medicine, London, United Kingdom.; The members of the LSHTM Centre for Mathematical Modelling of Infectious Diseases COVID-19 Working Group are listed at the end of this article.; Centre for Mathematical Modelling of Infectious Diseases, Department of Infectious Disease Epidemiology, London School of Hygiene and Tropical Medicine, London, United Kingdom.",Euro surveillance : bulletin Europeen sur les maladies transmissibles = European communicable disease bulletin,2020,Y,Surveillance; intensive care unit; mathematical model; Reproduction Number; Sars-cov-2; Coronavirus Disease 2019,,,"An exponential growth model was fitted to critical care admissions from two surveillance databases to determine likely coronavirus disease (COVID-19) case numbers, critical care admissions and epidemic growth in the United Kingdom before the national lockdown. We estimate, on 23 March, a median of 114,000 (95% credible interval (CrI): 78,000-173,000) new cases and 258 (95% CrI: 220-319) new critical care reports, with 527,000 (95% CrI: 362,000-797,000) cumulative cases since 16 February.","The authors of this paper estimate the number of cases and spread of COVID-19 using data on critical care admissions within the UK, from a period of February to March 2020. Their results suggest that the UK had hundreds of thousands of COVID-19 cases by the time the national lockdown was implemented. They highlight the usefulness of surveilling critical care data to better understand the dynamics of the epidemic and better inform the response measures.",doi:https://doi.org/10.2807/1560-7917.ES.2020.25.18.2000632; html:https://europepmc.org/articles/PMC7219029; pdf:https://europepmc.org/articles/PMC7219029?pdf=render
32613083,https://doi.org/10.12688/wellcomeopenres.15922.2,"Black, Asian and Minority Ethnic groups in England are at increased risk of death from COVID-19: indirect standardisation of NHS mortality data.","Aldridge RW, Lewer D, Katikireddi SV, Mathur R, Pathak N, Burns R, Fragaszy EB, Johnson AM, Devakumar D, Abubakar I, Hayward A.","UCL Public Health Data Science Research Group, Institute of Health Informatics, UCL, London, NW1 2DA, UK.; UCL Public Health Data Science Research Group, Institute of Health Informatics, UCL, London, NW1 2DA, UK.; UCL Collaborative Centre for Inclusion Health, Institute of Epidemiology and Health Care, UCL, London, WC1E 7HB, UK.; MRC/CSO Social & Public Health Sciences Unit, University of Glasgow, London, G2 3AX, UK.; Department of Non-Communicable Disease Epidemiology, London School of Hygiene and Tropical Medicine, London, WC1E 7HT, UK.; UCL Public Health Data Science Research Group, Institute of Health Informatics, UCL, London, NW1 2DA, UK.; Guy's and St Thomas's NHS Foundation Trust, London, SE1 9RT, UK.; UCL Public Health Data Science Research Group, Institute of Health Informatics, UCL, London, NW1 2DA, UK.; UCL Public Health Data Science Research Group, Institute of Health Informatics, UCL, London, NW1 2DA, UK.; Department of Infectious Disease Epidemiology, London School of Hygiene and Tropical Medicine, London, WC1E 7HT, UK.; UCL Institute for Global Health, London, WC1N 1EH, UK.; UCL Institute for Global Health, London, WC1N 1EH, UK.; UCL Institute for Global Health, London, WC1N 1EH, UK.; UCL Collaborative Centre for Inclusion Health, Institute of Epidemiology and Health Care, UCL, London, WC1E 7HB, UK.",Wellcome open research,2020,Y,Mortality; Minority Ethnic Groups; Covid-19; Sars-cov-2,,,"Background: International and UK data suggest that Black, Asian and Minority Ethnic (BAME) groups are at increased risk of infection and death from COVID-19. We aimed to explore the risk of death in minority ethnic groups in England using data reported by NHS England. Methods: We used NHS data on patients with a positive COVID-19 test who died in hospitals in England published on 28th April, with deaths by ethnicity available from 1st March 2020 up to 5pm on 21 April 2020. We undertook indirect standardisation of these data (using the whole population of England as the reference) to produce ethnic specific standardised mortality ratios (SMRs) adjusted for age and geographical region. Results: The largest total number of deaths in minority ethnic groups were Indian (492 deaths) and Black Caribbean (460 deaths) groups. Adjusting for region we found a lower risk of death for White Irish (SMR 0.52; 95%CIs 0.45-0.60) and White British ethnic groups (0.88; 95%CIs 0.86-0.0.89), but increased risk of death for Black African (3.24; 95%CIs 2.90-3.62), Black Caribbean (2.21; 95%CIs 2.02-2.41), Pakistani (3.29; 95%CIs 2.96-3.64), Bangladeshi (2.41; 95%CIs 1.98-2.91) and Indian (1.70; 95%CIs 1.56-1.85) minority ethnic groups. Conclusion: Our analysis adds to the evidence that BAME people are at increased risk of death from COVID-19 even after adjusting for geographical region, but was limited by the lack of data on deaths outside of NHS settings and ethnicity denominator data being based on the 2011 census. Despite these limitations, we believe there is an urgent need to take action to reduce the risk of death for BAME groups and better understand why some ethnic groups experience greater risk. Actions that are likely to reduce these inequities include ensuring adequate income protection, reducing occupational risks, reducing barriers in accessing healthcare and providing culturally and linguistically appropriate public health communications.",,doi:https://doi.org/10.12688/wellcomeopenres.15922.2; html:https://europepmc.org/articles/PMC7317462; pdf:https://europepmc.org/articles/PMC7317462?pdf=render
32518842,https://doi.org/10.12688/wellcomeopenres.15786.1,Inferring the number of COVID-19 cases from recently reported deaths.,"Jombart T, van Zandvoort K, Russell TW, Jarvis CI, Gimma A, Abbott S, Clifford S, Funk S, Gibbs H, Liu Y, Pearson CAB, Bosse NI, Centre for the Mathematical Modelling of Infectious Diseases COVID-19 Working Group, Eggo RM, Kucharski AJ, Edmunds WJ.","Infectious Disease Epidemiology, London School of Hygiene & Tropical Medicine, London, UK.; UK Public Health Rapid Support Team, London, UK.; MRC Centre for Global Infectious Disease Analysis, Imperial College London, London, UK.; Infectious Disease Epidemiology, London School of Hygiene & Tropical Medicine, London, UK.; Infectious Disease Epidemiology, London School of Hygiene & Tropical Medicine, London, UK.; Infectious Disease Epidemiology, London School of Hygiene & Tropical Medicine, London, UK.; Infectious Disease Epidemiology, London School of Hygiene & Tropical Medicine, London, UK.; Infectious Disease Epidemiology, London School of Hygiene & Tropical Medicine, London, UK.; Infectious Disease Epidemiology, London School of Hygiene & Tropical Medicine, London, UK.; Infectious Disease Epidemiology, London School of Hygiene & Tropical Medicine, London, UK.; Infectious Disease Epidemiology, London School of Hygiene & Tropical Medicine, London, UK.; Infectious Disease Epidemiology, London School of Hygiene & Tropical Medicine, London, UK.; Infectious Disease Epidemiology, London School of Hygiene & Tropical Medicine, London, UK.; South African Centre for Epidemiological Modelling and Analysis, Stellenbosch University, Stellenbosch, South Africa.; Infectious Disease Epidemiology, London School of Hygiene & Tropical Medicine, London, UK.; Infectious Disease Epidemiology, London School of Hygiene & Tropical Medicine, London, UK.; Infectious Disease Epidemiology, London School of Hygiene & Tropical Medicine, London, UK.; Infectious Disease Epidemiology, London School of Hygiene & Tropical Medicine, London, UK.",Wellcome open research,2020,Y,Estimation; Statistics; epidemics; outbreak; Modelling; Covid-19; Sars-cov-2,,,"We estimate the number of COVID-19 cases from newly reported deaths in a population without previous reports. Our results suggest that by the time a single death occurs, hundreds to thousands of cases are likely to be present in that population. This suggests containment via contact tracing will be challenging at this point, and other response strategies should be considered. Our approach is implemented in a publicly available, user-friendly, online tool.",,doi:https://doi.org/10.12688/wellcomeopenres.15786.1; html:https://europepmc.org/articles/PMC7255910; pdf:https://europepmc.org/articles/PMC7255910?pdf=render
