id,doi,title,authorString,authorAffiliations,journalTitle,pubYear,abstract
31331193,https://doi.org/10.1161/CIRCULATIONAHA.119.041546,Impact of ADCY9 Genotype on Response to Anacetrapib.,"Hopewell JC, Ibrahim M, Hill M, Shaw PM, Braunwald E, Blaustein RO, Bowman L, Landray MJ, Sabatine MS, Collins R, HPS3/TIMI55 - REVEAL Collaborative Group.","Clinical Trial Service Unit and Epidemiological Studies Unit, Nuffield Department of Population Health, University of Oxford, Oxford, UK.; Clinical Trial Service Unit and Epidemiological Studies Unit, Nuffield Department of Population Health, University of Oxford, Oxford, UK.; Clinical Trial Service Unit and Epidemiological Studies Unit, Nuffield Department of Population Health, University of Oxford, Oxford, UK; Medical Research Council Population Health Research Unit, Nuffield Department of Population Health, University of Oxford, Oxford, UK.; Department of Genetics and Pharmacogenomics, Merck Research Laboratories, Merck & Co., Inc., Kenilworth, NJ.; TIMI Study Group, Division of Cardiovascular Medicine, Brigham and Women's Hospital and Harvard Medical School, Hale Building for Transformative Medicine, Boston, MA.; Cardiovascular Clinical Research, Merck Research Laboratories, Merck & Co., Inc., Kenilworth, NJ.; Clinical Trial Service Unit and Epidemiological Studies Unit, Nuffield Department of Population Health, University of Oxford, Oxford, UK; Medical Research Council Population Health Research Unit, Nuffield Department of Population Health, University of Oxford, Oxford, UK.; Clinical Trial Service Unit and Epidemiological Studies Unit, Nuffield Department of Population Health, University of Oxford, Oxford, UK.; TIMI Study Group, Division of Cardiovascular Medicine, Brigham and Women's Hospital and Harvard Medical School, Hale Building for Transformative Medicine, Boston, MA.; Clinical Trial Service Unit and Epidemiological Studies Unit, Nuffield Department of Population Health, University of Oxford, Oxford, UK.",Circulation,2019,"BACKGROUND:Exploratory analyses of previous randomized trials generated a hypothesis that the clinical response to CETP inhibitor therapy differs by ADCY9 genotype, prompting the ongoing dal-GenE trial in individuals with a particular genetic profile. The randomized placebo-controlled REVEAL trial demonstrated the clinical efficacy of the CETP inhibitor anacetrapib among patients with pre-existing atherosclerotic vascular disease. In the present study, we have examined the impact of ADCY9 genotype on response to anacetrapib within the REVEAL trial. METHODS:Individuals with stable atherosclerotic vascular disease, who were treated with intensive atorvastatin therapy, received either anacetrapib 100 mg daily or matching placebo. Cox proportional hazards models, adjusted for the first 5 principal components of ancestry, were used to estimate the effects of allocation to anacetrapib on major vascular events (a composite of coronary death, myocardial infarction, coronary revascularization or presumed ischaemic stroke) and the interaction with ADCY9 rs1967309 genotype. RESULTS:Among 19,210 genotyped individuals of European ancestry, 2,504 (13.0%) had a first major vascular event during 4 years median follow-up: 1,216 (12.6%) among anacetrapib-allocated participants and 1,288 (13.4%) among placebo-allocated participants. Proportional reductions in the risk of major vascular events with anacetrapib did not differ significantly by ADCY9 genotype: HR = 0.92 (95% CI, 0.81-1.05) for GG; HR = 0.94 (95% CI, 0.84-1.06) for AG; and HR = 0.93 (95% CI, 0.76-1.13) for AA genotype carriers respectively; genotypic p for interaction = 0.96. Furthermore, there were no associations between ADCY9 genotype and the proportional reductions in the separate components of major vascular events, or meaningful differences in lipid response to anacetrapib. CONCLUSIONS:The REVEAL trial is the single largest study to date evaluating the ADCY9 pharmacogenetic interaction. It provides no support for the hypothesis that ADCY9 genotype is materially relevant to the clinical effects of the CETP inhibitor anacetrapib. The ongoing dal-GenE study will provide direct evidence as to whether there is any specific pharmacogenetic interaction with dalcetrapib. CLINICAL TRIAL REGISTRATION:URL: https://www.clinicaltrials.gov Unique Identifier: NCT01252953; URL: http://www.isrctn.com Unique Identifier: ISRCTN48678192; URL: https://www.clinicaltrialsregister.eu Unique Identifier: 2010-023467-18."
31978332,https://doi.org/10.1016/j.ajhg.2020.01.003,A Multi-tissue Transcriptome Analysis of Human Metabolites Guides Interpretability of Associations Based on Multi-SNP Models for Gene Expression.,"Ndungu A, Payne A, Torres JM, van de Bunt M, McCarthy MI.","The Wellcome Centre for Human Genetics, Nuffield Department of Medicine, University of Oxford, Oxford, OX3 7BN, UK.; The Wellcome Centre for Human Genetics, Nuffield Department of Medicine, University of Oxford, Oxford, OX3 7BN, UK.; The Wellcome Centre for Human Genetics, Nuffield Department of Medicine, University of Oxford, Oxford, OX3 7BN, UK.; The Wellcome Centre for Human Genetics, Nuffield Department of Medicine, University of Oxford, Oxford, OX3 7BN, UK; Oxford Centre for Diabetes, Endocrinology and Metabolism, Radcliffe Department of Medicine, University of Oxford, Oxford, OX3 7LE, UK; Department of Bioinformatics and Data Mining, Novo Nordisk A/S, Måløv, 2760, DK.; The Wellcome Centre for Human Genetics, Nuffield Department of Medicine, University of Oxford, Oxford, OX3 7BN, UK; Oxford Centre for Diabetes, Endocrinology and Metabolism, Radcliffe Department of Medicine, University of Oxford, Oxford, OX3 7LE, UK. Electronic address: mccarthy.mark@gene.com.",American journal of human genetics,2020,"There is particular interest in transcriptome-wide association studies (TWAS) gene-level tests based on multi-SNP predictive models of gene expression-for identifying causal genes at loci associated with complex traits. However, interpretation of TWAS associations may be complicated by divergent effects of model SNPs on phenotype and gene expression. We developed an iterative modeling scheme for obtaining multi-SNP models of gene expression and applied this framework to generate expression models for 43 human tissues from the Genotype-Tissue Expression (GTEx) Project. We characterized the performance of single- and multi-SNP models for identifying causal genes in GWAS data for 46 circulating metabolites. We show that: (A) multi-SNP models captured more variation in expression than did the top cis-eQTL (median 2-fold improvement); (B) predicted expression based on multi-SNP models was associated (false discovery rate < 0.01) with metabolite levels for 826 unique gene-metabolite pairs, but, after stepwise conditional analyses, 90% were dominated by a single eQTL SNP; (C) among the 35% of associations where a SNP in the expression model was a significant cis-eQTL and metabolomic-QTL (met-QTL), 92% demonstrated colocalization between these signals, but interpretation was often complicated by incomplete overlap of QTLs in multi-SNP models; and (D) using a ""truth"" set of causal genes at 61 met-QTLs, the sensitivity was high (67%), but the positive predictive value was low, as only 8% of TWAS associations (19% when restricted to colocalized associations at met-QTLs) involved true causal genes. These results guide the interpretation of TWAS and highlight the need for corroborative data to provide confident assignment of causality."
31951611,https://doi.org/10.1371/journal.pbio.3000586,Dating genomic variants and shared ancestry in population-scale sequencing data.,"Albers PK, McVean G.","Big Data Institute, Li Ka Shing Centre for Health Information and Discovery, University of Oxford, Oxford, United Kingdom.; Big Data Institute, Li Ka Shing Centre for Health Information and Discovery, University of Oxford, Oxford, United Kingdom.",PLoS biology,2020,"The origin and fate of new mutations within species is the fundamental process underlying evolution. However, while much attention has been focused on characterizing the presence, frequency, and phenotypic impact of genetic variation, the evolutionary histories of most variants are largely unexplored. We have developed a nonparametric approach for estimating the date of origin of genetic variants in large-scale sequencing data sets. The accuracy and robustness of the approach is demonstrated through simulation. Using data from two publicly available human genomic diversity resources, we estimated the age of more than 45 million single-nucleotide polymorphisms (SNPs) in the human genome and release the Atlas of Variant Age as a public online database. We characterize the relationship between variant age and frequency in different geographical regions and demonstrate the value of age information in interpreting variants of functional and selective importance. Finally, we use allele age estimates to power a rapid approach for inferring the ancestry shared between individual genomes and to quantify genealogical relationships at different points in the past, as well as to describe and explore the evolutionary history of modern human populations."
31197928,https://doi.org/10.1002/pds.4811,Methods to generate and validate a Pregnancy Register in the UK Clinical Practice Research Datalink primary care database.,"Minassian C, Williams R, Meeraus WH, Smeeth L, Campbell OMR, Thomas SL.","Department of Non-communicable Disease Epidemiology, London School of Hygiene & Tropical Medicine, London, UK.; Clinical Practice Research Datalink, Medicines and Healthcare Products Regulatory Agency, London, UK.; Clinical Practice Research Datalink, Medicines and Healthcare Products Regulatory Agency, London, UK.; Department of Non-communicable Disease Epidemiology, London School of Hygiene & Tropical Medicine, London, UK.; Department of Infectious Disease Epidemiology, London School of Hygiene & Tropical Medicine, London, UK.; Department of Infectious Disease Epidemiology, London School of Hygiene & Tropical Medicine, London, UK.",Pharmacoepidemiology and drug safety,2019,"PURPOSE:Primary care databases are increasingly used for researching pregnancy, eg, the effects of maternal drug exposures. However, ascertaining pregnancies, their timing, and outcomes in these data is challenging. While individual studies have adopted different methods, no systematic approach to characterise all pregnancies in a primary care database has yet been published. Therefore, we developed a new algorithm to establish a Pregnancy Register in the UK Clinical Practice Research Datalink (CPRD) GOLD primary care database. METHODS:We compiled over 4000 read and entity codes to identify pregnancy-related records among women aged 11 to 49 years in CPRD GOLD. Codes were categorised by the stage or outcome of pregnancy to facilitate delineation of pregnancy episodes. We constructed hierarchical rule systems to handle information from multiple sources. We assessed the validity of the Register to identify pregnancy outcomes by comparing our results to linked hospitalisation records and Office for National Statistics population rates. RESULTS:Our algorithm identified 5.8 million pregnancies among 2.4 million women (January 1987-February 2018). We observed close agreement with hospitalisation data regarding completeness of pregnancy outcomes (91% sensitivity for deliveries and 77% for pregnancy losses) and their timing (median 0 days difference, interquartile range 0-2 days). Miscarriage and prematurity rates were consistent with population figures, although termination and, to a lesser extent, live birth rates were underestimated in the Register. CONCLUSIONS:The Pregnancy Register offers huge research potential because of its large size, high completeness, and availability. Further validation work is underway to enhance this data resource and identify optimal approaches for its use."
31171806,https://doi.org/10.1038/s41598-019-44907-8,On neighbourhood degree sequences of complex networks.,Smith KM.,"Usher Institute of Population Health Science and Informatics, University of Edinburgh, 9 BioQuarter, Little France, Edinburgh, EH16 4UX, UK. k.smith@ed.ac.uk.",Scientific reports,2019,"Network topology is a fundamental aspect of network science that allows us to gather insights into the complicated relational architectures of the world we inhabit. We provide a first specific study of neighbourhood degree sequences in complex networks. We consider how to explicitly characterise important physical concepts such as similarity, heterogeneity and organization in these sequences, as well as updating the notion of hierarchical complexity to reflect previously unnoticed organizational principles. We also point out that neighbourhood degree sequences are related to a powerful subtree kernel for unlabeled graph classification. We study these newly defined sequence properties in a comprehensive array of graph models and over 200 real-world networks. We find that these indices are neither highly correlated with each other nor with classical network indices. Importantly, the sequences of a wide variety of real world networks are found to have greater similarity and organisation than is expected for networks of their given degree distributions. Notably, while biological, social and technological networks all showed consistently large neighbourhood similarity and organisation, hierarchical complexity was not a consistent feature of real world networks. Neighbourhood degree sequences are an interesting tool for describing unique and important characteristics of complex networks."
31822727,https://doi.org/10.1038/s41598-019-55098-7,Co-incidence of RCC-susceptibility polymorphisms with HIF cis-acting sequences supports a pathway tuning model of cancer.,"Schmid V, Lafleur VN, Lombardi O, Li R, Salama R, Colli L, Choudhry H, Chanock S, Ratcliffe PJ, Mole DR.","Ludwig Institute for Cancer Research, University of Oxford, Old Road Campus, Headington, Oxford, OX3 7FZ, United Kingdom.; NDM Research Building, University of Oxford, Old Road Campus, Headington, Oxford, OX3 7FZ, United Kingdom.; NDM Research Building, University of Oxford, Old Road Campus, Headington, Oxford, OX3 7FZ, United Kingdom.; NDM Research Building, University of Oxford, Old Road Campus, Headington, Oxford, OX3 7FZ, United Kingdom.; NDM Research Building, University of Oxford, Old Road Campus, Headington, Oxford, OX3 7FZ, United Kingdom.; Division of Cancer Epidemiology and Genetics, room 7E412, MSC 9776, National Cancer Institute, 9609 Medical Center Drive, Bethesda, MD, 20892-9776, USA.; Department of Biochemistry, Faculty of Science, Center of Innovation in Personalized Medicine, King Fahd Center for Medical Research, King Abdulaziz University, Jeddah, Saudi Arabia.; Division of Cancer Epidemiology and Genetics, room 7E412, MSC 9776, National Cancer Institute, 9609 Medical Center Drive, Bethesda, MD, 20892-9776, USA.; Ludwig Institute for Cancer Research, University of Oxford, Old Road Campus, Headington, Oxford, OX3 7FZ, United Kingdom. peter.ratcliffe@ndm.ox.ac.uk.; NDM Research Building, University of Oxford, Old Road Campus, Headington, Oxford, OX3 7FZ, United Kingdom. david.mole@ndm.ox.ac.uk.",Scientific reports,2019,"Emerging evidence suggests that dysregulation of oncogenic pathways requires precise tuning in order for cancer to develop. To test this, we examined the overlap between cis-acting elements of the hypoxia-inducible factor (HIF) pathway and cancer-susceptibility polymorphisms as defined in genome-wide association studies (GWAS). In renal cancer, where HIF is constitutively and un-physiologically activated by mutation of the von Hippel-Lindau tumour suppressor, we observed marked excess overlap, which extended to potential susceptibility polymorphisms that are below the conventional threshold applied in GWAS. In contrast, in other cancers where HIF is upregulated by different mechanisms, including micro-environmental hypoxia, we observed no excess in overlap. Our findings support a 'pathway tuning' model of cancer, whereby precise modulation of multiple outputs of specific, activated pathways is important in oncogenesis. This implies that selective pressures to modulate such pathways operate during cancer development and should focus attempts to identify their nature and consequences."
31801372,https://doi.org/10.1161/ATVBAHA.119.313226,"Carotid Intima-Media Thickness: Novel Loci, Sex-Specific Effects, and Genetic Correlations With Obesity and Glucometabolic Traits in UK Biobank.","Strawbridge RJ, Ward J, Bailey MES, Cullen B, Ferguson A, Graham N, Johnston KJA, Lyall LM, Pearsall R, Pell J, Shaw RJ, Tank R, Lyall DM, Smith DJ.","From the Institute of Health and Wellbeing (R.J.S., J.W., B.C., A.F., N.G., K.J.A.J., L.M.L., R.P., J.P., R.J.S., R.T., D.M.L., D.J.S.), University of Glasgow, United Kingdom.; From the Institute of Health and Wellbeing (R.J.S., J.W., B.C., A.F., N.G., K.J.A.J., L.M.L., R.P., J.P., R.J.S., R.T., D.M.L., D.J.S.), University of Glasgow, United Kingdom.; School of Life Sciences, College of Medical, Veterinary and Life Sciences (M.E.S.B., K.J.A.J.), University of Glasgow, United Kingdom.; From the Institute of Health and Wellbeing (R.J.S., J.W., B.C., A.F., N.G., K.J.A.J., L.M.L., R.P., J.P., R.J.S., R.T., D.M.L., D.J.S.), University of Glasgow, United Kingdom.; From the Institute of Health and Wellbeing (R.J.S., J.W., B.C., A.F., N.G., K.J.A.J., L.M.L., R.P., J.P., R.J.S., R.T., D.M.L., D.J.S.), University of Glasgow, United Kingdom.; From the Institute of Health and Wellbeing (R.J.S., J.W., B.C., A.F., N.G., K.J.A.J., L.M.L., R.P., J.P., R.J.S., R.T., D.M.L., D.J.S.), University of Glasgow, United Kingdom.; From the Institute of Health and Wellbeing (R.J.S., J.W., B.C., A.F., N.G., K.J.A.J., L.M.L., R.P., J.P., R.J.S., R.T., D.M.L., D.J.S.), University of Glasgow, United Kingdom.; From the Institute of Health and Wellbeing (R.J.S., J.W., B.C., A.F., N.G., K.J.A.J., L.M.L., R.P., J.P., R.J.S., R.T., D.M.L., D.J.S.), University of Glasgow, United Kingdom.; From the Institute of Health and Wellbeing (R.J.S., J.W., B.C., A.F., N.G., K.J.A.J., L.M.L., R.P., J.P., R.J.S., R.T., D.M.L., D.J.S.), University of Glasgow, United Kingdom.; From the Institute of Health and Wellbeing (R.J.S., J.W., B.C., A.F., N.G., K.J.A.J., L.M.L., R.P., J.P., R.J.S., R.T., D.M.L., D.J.S.), University of Glasgow, United Kingdom.; From the Institute of Health and Wellbeing (R.J.S., J.W., B.C., A.F., N.G., K.J.A.J., L.M.L., R.P., J.P., R.J.S., R.T., D.M.L., D.J.S.), University of Glasgow, United Kingdom.; From the Institute of Health and Wellbeing (R.J.S., J.W., B.C., A.F., N.G., K.J.A.J., L.M.L., R.P., J.P., R.J.S., R.T., D.M.L., D.J.S.), University of Glasgow, United Kingdom.; From the Institute of Health and Wellbeing (R.J.S., J.W., B.C., A.F., N.G., K.J.A.J., L.M.L., R.P., J.P., R.J.S., R.T., D.M.L., D.J.S.), University of Glasgow, United Kingdom.; From the Institute of Health and Wellbeing (R.J.S., J.W., B.C., A.F., N.G., K.J.A.J., L.M.L., R.P., J.P., R.J.S., R.T., D.M.L., D.J.S.), University of Glasgow, United Kingdom.","Arteriosclerosis, thrombosis, and vascular biology",2020,"OBJECTIVE:Atherosclerosis is the underlying cause of most cardiovascular disease, but mechanisms underlying atherosclerosis are incompletely understood. Ultrasound measurement of the carotid intima-media thickness (cIMT) can be used to measure vascular remodeling, which is indicative of atherosclerosis. Genome-wide association studies have identified many genetic loci associated with cIMT, but heterogeneity of measurements collected by many small cohorts have been a major limitation in these efforts. Here, we conducted genome-wide association analyses in UKB (UK Biobank; N=22 179), the largest single study with consistent cIMT measurements. Approach and Results: We used BOLT-LMM software to run linear regression of cIMT in UKB, adjusted for age, sex, and genotyping chip. In white British participants, we identified 5 novel loci associated with cIMT and replicated most previously reported loci. In the first sex-specific analyses of cIMT, we identified a locus on chromosome 5, associated with cIMT in women only and highlight VCAN as a good candidate gene at this locus. Genetic correlations with body mass index and glucometabolic traits were also observed. Two loci influenced risk of ischemic heart disease. CONCLUSIONS:These findings replicate previously reported associations, highlight novel biology, and provide new directions for investigating the sex differences observed in cardiovascular disease presentation and progression."
31795195,https://doi.org/10.3390/cancers11121895,Identification of Circulating Genomic and Metabolic Biomarkers in Intrahepatic Cholangiocarcinoma.,"Winter H, Kaisaki PJ, Harvey J, Giacopuzzi E, Ferla MP, Pentony MM, Knight SJL, Sharma RA, Taylor JC, McCullagh JSO.","National Institute for Health Research (NIHR) Oxford Biomedical Research Centre, Wellcome Centre for Human Genetics, University of Oxford, Oxford OX3 7BN, UK.; National Institute for Health Research (NIHR) Oxford Biomedical Research Centre, Wellcome Centre for Human Genetics, University of Oxford, Oxford OX3 7BN, UK.; Bristol Cancer Institute, Horfield Rd, Bristol BS2 8ED, UK.; National Institute for Health Research (NIHR) Oxford Biomedical Research Centre, Wellcome Centre for Human Genetics, University of Oxford, Oxford OX3 7BN, UK.; National Institute for Health Research (NIHR) Oxford Biomedical Research Centre, Wellcome Centre for Human Genetics, University of Oxford, Oxford OX3 7BN, UK.; National Institute for Health Research (NIHR) Oxford Biomedical Research Centre, Wellcome Centre for Human Genetics, University of Oxford, Oxford OX3 7BN, UK.; National Institute for Health Research (NIHR) Oxford Biomedical Research Centre, Wellcome Centre for Human Genetics, University of Oxford, Oxford OX3 7BN, UK.; Chemistry Research Laboratory, Department of Chemistry, University of Oxford, Oxford OX1 3TA, UK.; National Institute for Health Research (NIHR) Oxford Biomedical Research Centre, Wellcome Centre for Human Genetics, University of Oxford, Oxford OX3 7BN, UK.; Bristol Cancer Institute, Horfield Rd, Bristol BS2 8ED, UK.",Cancers,2019,"Intrahepatic cholangiocarcinoma (ICC) is an aggressive cancer arising from the bile ducts with a need for earlier diagnosis and a greater range of treatment options. KRAS/NRAS mutations are common in ICC tumours and 6-32% of patients also have isocitrate dehydrogenase 1 and 2 (IDH1 and IDH2) gene mutations associated with metabolic changes. This feasibility study investigated sequencing circulating tumour DNA (ctDNA) combined with metabolite profiling of plasma as a method for biomarker discovery in ICC patients. Plasma was collected from four ICC patients receiving radio-embolisation and healthy controls at multiple time points. ctDNA was sequenced using Ampliseq cancer hotspot panel-v2 on Ion Torrent PGM for single nucleotide variants (SNV) detection and with Illumina whole genome sequencing for copy number variants (CNV) and further targeted examination for SNVs. Untargeted analysis of metabolites from patient and control plasma was performed using liquid chromatography coupled with high-resolution tandem mass spectrometry (LC-MS/MS). Metabolite identification was performed using multi-parameter comparisons with analysis of authentic standards, and univariate statistical analysis was performed to identify differences in metabolite abundance between patient and control samples. Recurrent somatic SNVs and CNVs were identified in ctDNA from three out of four patients that included both NRAS and IDH1 mutations linked to ICC. Plasma metabolite analysis revealed biomarker metabolites associated with ICC and in particular 2-hydroxyglutarate (2-HG) levels were elevated in both samples from the only patient showing a variant allele in IDH1. A reduction in the number of CNVs was observed with treatment. This study demonstrates that ctDNA and metabolite levels can be identified and correlated in ICC patient blood samples and differentiated from healthy controls. We conclude that combining genomic and metabolic analysis of plasma offers an effective approach to biomarker identification with potential for disease stratification and early detection studies."
