id,doi,title,authorString,authorAffiliations,journalTitle,pubYear,abstract
30551632,https://doi.org/10.3390/ijerph15122845,"Incidence, Costs and Predictors of Non-Union, Delayed Union and Mal-Union Following Long Bone Fracture.","Ekegren CL, Edwards ER, de Steiger R, Gabbe BJ.",,International journal of environmental research and public health,2018,"Fracture healing complications are common and result in significant healthcare burden. The aim of this study was to determine the rate, costs and predictors of two-year readmission for surgical management of healing complications (delayed, mal, non-union) following fracture of the humerus, tibia or femur. Humeral, tibial and femoral (excluding proximal) fractures registered by the Victorian Orthopaedic Trauma Outcomes Registry over five years (n = 3962) were linked with population-level hospital admissions data to identify two-year readmissions for delayed, mal or non-union. Study outcomes included hospital length-of-stay (LOS) and inpatient costs. Multivariable logistic regression was used to determine demographic and injury-related factors associated with admission for fracture healing complications. Of the 3886 patients linked, 8.1% were readmitted for healing complications within two years post-fracture, with non-union the most common complication and higher rates for femoral and tibial shaft fractures. Admissions for fracture healing complications incurred total costs of $4.9 million AUD, with a median LOS of two days. After adjusting for confounders, patients had higher odds of developing complications if they were older, receiving compensation or had tibial or femoral shaft fractures. Patients who are older, with tibial and femoral shaft fractures should be targeted for future research aimed at preventing complications."
31564467,https://doi.org/10.1016/s2215-0366(19)30369-4,"The burden of mental ill health associated with childhood maltreatment in the UK, using The Health Improvement Network database: a population-based retrospective cohort study.","Chandan JS, Thomas T, Gokhale KM, Bandyopadhyay S, Taylor J, Nirantharakumar K.",,The lancet. Psychiatry,2019,"BACKGROUND:Childhood maltreatment is a global public health, human rights, and moral issue that is associated with a substantial mental health burden. We aimed to assess the association between childhood maltreatment and the development of mental ill health and the initiation of new prescriptions for mental ill health. METHODS:In this population-based, retrospective, open cohort study, we used a dataset from individuals in The Health Improvement Network (THIN) database. THIN database comprises UK electronic medical records taken from 787 general practices throughout the UK. We used read codes in these records to identify exposed patients (those with a read code identifying officially confirmed childhood maltreatment or a maltreatment-related concern) and up to two unexposed patients (those without such read codes) from the same general practice, who were matched by age and sex. We evaluated the risk of developing depression, anxiety, or serious mental illness (a composite mental ill health outcome) or initiation of a prescription drug used to treat mental ill health, and the odds ratio of these events at baseline, in the exposed versus unexposed patients. FINDINGS:The first possible date for cohort entry (the study start date) was Jan 1, 1995, and patients could enter the cohort until the study end date, Dec 31, 2018. During the study period, 11 831 850 patients were eligible to participate. Of these patients, we identified 217 758 (1·8%) patients with any recorded childhood maltreatment. These patients were matched to 423 410 unexposed control patients with no recorded exposure to childhood maltreatment. The exposed group were followed up for a median of 1·8 years (IQR 0·6-4·3) versus 3·2 years (1·3-6·1) in the unexposed group. During the study period, 11 665 (5·9%) new diagnoses of mental ill health were made in the exposed group, giving an incidence rate of 16·8 events per 1000 person-years versus 15 301 (3·7%) new recorded diagnoses at an incidence rate of 8·3 events per 1000 person-years in the unexposed cohort, giving an adjusted IRR of 2·14 (95% CI 2·08-2·19). 30 911 (14·8%) patients in the exposed group received a new prescription for any type of mental ill health (incidence rate 46·5 events per 1000 person-years) versus 36 390 (8·9%) patients in the unexposed group (20·5 per 1000 person-years) resulting in an adjusted IRR of 2·44 (95% CI 2·40-2·48). INTERPRETATION:Childhood maltreatment is thought to affect one in three children globally; therefore, a doubled risk of developing mental ill health among these individuals represents a substantial contribution to the mental ill health burden in the UK. It is imperative that public health approaches, including those aimed at preventing and detecting childhood maltreatment and its associated negative consequences, are implemented to prevent mental ill health. FUNDING:None."
31711543,https://doi.org/10.1186/s13326-019-0214-4,Natural language processing for disease phenotyping in UK primary care records for research: a pilot study in myocardial infarction and death.,"Shah AD, Bailey E, Williams T, Denaxas S, Dobson R, Hemingway H.",,Journal of biomedical semantics,2019,"BACKGROUND:Free text in electronic health records (EHR) may contain additional phenotypic information beyond structured (coded) information. For major health events - heart attack and death - there is a lack of studies evaluating the extent to which free text in the primary care record might add information. Our objectives were to describe the contribution of free text in primary care to the recording of information about myocardial infarction (MI), including subtype, left ventricular function, laboratory results and symptoms; and recording of cause of death. We used the CALIBER EHR research platform which contains primary care data from the Clinical Practice Research Datalink (CPRD) linked to hospital admission data, the MINAP registry of acute coronary syndromes and the death registry. In CALIBER we randomly selected 2000 patients with MI and 1800 deaths. We implemented a rule-based natural language engine, the Freetext Matching Algorithm, on site at CPRD to analyse free text in the primary care record without raw data being released to researchers. We analysed text recorded within 90 days before or 90 days after the MI, and on or after the date of death. RESULTS:We extracted 10,927 diagnoses, 3658 test results, 3313 statements of negation, and 850 suspected diagnoses from the myocardial infarction patients. Inclusion of free text increased the recorded proportion of patients with chest pain in the week prior to MI from 19 to 27%, and differentiated between MI subtypes in a quarter more patients than structured data alone. Cause of death was incompletely recorded in primary care; in 36% the cause was in coded data and in 21% it was in free text. Only 47% of patients had exactly the same cause of death in primary care and the death registry, but this did not differ between coded and free text causes of death. CONCLUSIONS:Among patients who suffer MI or die, unstructured free text in primary care records contains much information that is potentially useful for research such as symptoms, investigation results and specific diagnoses. Access to large scale unstructured data in electronic health records (millions of patients) might yield important insights."
31699727,https://doi.org/10.1136/bmjopen-2019-030882,Optical coherence tomography (OCT) in unconscious and systemically unwell patients using a mobile OCT device: a pilot study.,"Liu X, Kale AU, Capewell N, Talbot N, Ahmed S, Keane PA, Mollan S, Belli A, Blanch RJ, Veenith T, Denniston AK.",,BMJ open,2019,"OBJECTIVE:This study aims to evaluate the feasibility of retinal imaging in critical care using a novel mobile optical coherence tomography (OCT) device. The Heidelberg SPECTRALIS FLEX module (Heidelberg Engineering, Heidelberg, Germany) is an OCT unit with a boom arm, enabling ocular OCT assessment in less mobile patients. DESIGN:We undertook an evaluation of the feasibility of using the SPECTRALIS FLEX for undertaking ocular OCT images in unconscious and critically ill patients. SETTING:This study was conducted in the critical care unit of a large tertiary referral unit in the United Kingdom. PARTICIPANTS:13 systemically unwell patients admitted to the critical care unit were purposively sampled to enable evaluation in patients with a range of clinical states. OUTCOME MEASURES:The primary outcome was the feasibility of acquiring clinically interpretable OCT scans on a consecutive series of patients. The standardised scanning protocol included macula-focused OCT, OCT optic nerve head (ONH), OCT angiography (OCTA) of the macula and ONH OCTA. RESULTS:OCT images from 13 patients were attempted. The success rates of each scan type are 84% for OCT macula, 76% for OCT ONH, 56% for OCTA macula and 36% for OCTA ONH. The overall mean success rate of scans per patient was 64% (95% CI 46% to 81%). Clinicians reported clinical value in 100% scans which were successfully obtained, including both ruling in and ruling out relevant ocular complications such as corneal thinning, macular oedema and optic disc swelling. The most common causes of failure to achieve clinically interpretable scans were inadequately sustained OCT alignment in delirious patients and a compromised ocular surface due to corneal exposure. CONCLUSIONS:This prospective evaluation indicates the feasibility and potential clinical value of the SPECTRALIS FLEX OCT system on the critical care unit. Portable OCT systems have the potential to bring instrument-based ophthalmic assessment to critically ill patients, enabling detection and micron-level monitoring of ocular complications."
32360702,https://doi.org/10.1016/j.ijcard.2020.04.068,Comorbidities and cause-specific outcomes in heart failure across the ejection fraction spectrum: A blueprint for clinical trial design.,"Savarese G, Settergren C, Schrage B, Thorvaldsen T, Löfman I, Sartipy U, Mellbin L, Meyers A, Fazeli Farsani S, Brueckmann M, Brodovicz KG, Vedin O, Asselbergs FW, Dahlström U, Cosentino F, Lund LH.",,International journal of cardiology,2020,"BACKGROUND:Comorbidities may differently affect treatment response and cause-specific outcomes in heart failure (HF) with preserved (HFpEF) vs. mid-range/mildly-reduced (HFmrEF) vs. reduced (HFrEF) ejection fraction (EF), complicating trial design. In patients with HF, we performed a comprehensive analysis of type 2 diabetes (T2DM), atrial fibrillation (AF) chronic kidney disease (CKD), and cause-specific outcomes. METHODS AND RESULTS:Of 42,583 patients from the Swedish HF registry (23% HFpEF, 21% HFmrEF, 56% HFrEF), 24% had T2DM, 51% CKD, 56% AF, and 8% all three comorbidities. HFpEF had higher prevalence of CKD and AF, HFmrEF had intermediate prevalence of AF, and prevalence of T2DM was similar across the EF spectrum. Patients with T2DM, AF and/or CKD were more likely to have also other comorbidities and more severe HF. Risk of cardiovascular (CV) events was highest in HFrEF vs. HFpEF and HFmrEF; non-CV risk was highest in HFpEF vs. HFmrEF vs. HFrEF. T2DM increased CV and non-CV events similarly but less so in HFpEF. CKD increased CV events somewhat more than non-CV events and less so in HFpEF. AF increased CV events considerably more than non-CV events and more so in HFpEF and HFmrEF. CONCLUSION:HFpEF is distinguished from HFmrEF and HFrEF by more comorbidities, non-CV events, but lower effect of T2DM and CKD on events. CV events are most frequent in HFrEF. To enrich for CV vs. non-CV events, trialists should not exclude patients with lower EF, AF and/or CKD, who report higher CV risk."
32327693,https://doi.org/10.1038/s42003-020-0921-5,Predicted loss and gain of function mutations in ACO1 are associated with erythropoiesis.,"Oskarsson GR, Oddsson A, Magnusson MK, Kristjansson RP, Halldorsson GH, Ferkingstad E, Zink F, Helgadottir A, Ivarsdottir EV, Arnadottir GA, Jensson BO, Katrinardottir H, Sveinbjornsson G, Kristinsdottir AM, Lee AL, Saemundsdottir J, Stefansdottir L, Sigurdsson JK, Davidsson OB, Benonisdottir S, Jonasdottir A, Jonasdottir A, Jonsson S, Gudmundsson RL, Asselbergs FW, Tragante V, Gunnarsson B, Masson G, Thorleifsson G, Rafnar T, Holm H, Olafsson I, Onundarson PT, Gudbjartsson DF, Norddahl GL, Thorsteinsdottir U, Sulem P, Stefansson K.",,Communications biology,2020,"Hemoglobin is the essential oxygen-carrying molecule in humans and is regulated by cellular iron and oxygen sensing mechanisms. To search for novel variants associated with hemoglobin concentration, we performed genome-wide association studies of hemoglobin concentration using a combined set of 684,122 individuals from Iceland and the UK. Notably, we found seven novel variants, six rare coding and one common, at the ACO1 locus associating with either decreased or increased hemoglobin concentration. Of these variants, the missense Cys506Ser and the stop-gained Lys334Ter mutations are specific to eight and ten generation pedigrees, respectively, and have the two largest effects in the study (EffectCys506Ser = -1.61 SD, CI95 = [-1.98, -1.35]; EffectLys334Ter = 0.63 SD, CI95 = [0.36, 0.91]). We also find Cys506Ser to associate with increased risk of persistent anemia (OR = 17.1, P = 2 × 10-14). The strong bidirectional effects seen in this study implicate ACO1, a known iron sensing molecule, as a major homeostatic regulator of hemoglobin concentration."
31442537,https://doi.org/10.1016/j.jaad.2019.08.039,Atopic dermatitis and risk of atrial fibrillation or flutter: A 35-year follow-up study.,"Schmidt SAJ, Olsen M, Schmidt M, Vestergaard C, Langan SM, Deleuran MS, Riis JL.",,Journal of the American Academy of Dermatology,2019,"BACKGROUND:Atopic dermatitis is characterized by chronic inflammation, which is a risk factor for atrial fibrillation. OBJECTIVE:To examine the association between hospital-diagnosed atopic dermatitis and atrial fibrillation. METHODS:Using linked population-based Danish registries, we identified persons with an inpatient or outpatient hospital diagnosis of atopic dermatitis during 1977-2013 and a comparison cohort individually matched to the atopic dermatitis cohort. We followed cohorts until death, emigration, atrial fibrillation diagnosis, or end of study (January 1, 2013). We compared 35-year risk of atrial fibrillation and estimated hazard ratios with 95% confidence intervals using Cox regression, adjusting for birth year and sex. We validated 100 atopic dermatitis diagnoses from a dermatologic department through medical record review. RESULTS:We included 13,126 persons with atopic dermatitis and 124,211 comparators and followed them for a median of 19.3 years. The 35-year risk of atrial fibrillation was 0.81% and 0.67%, respectively. The positive predictive value of atopic dermatitis diagnoses was 99%. The hazard ratio was 1.2 (95% confidence interval 1.0-1.6) and remained increased after adjusting for various atrial fibrillation risk factors. LIMITATIONS:Analyses were limited to persons with moderate-to-severe atopic dermatitis, and we had no lifestyle data. CONCLUSION:Patients with hospital-diagnosed atopic dermatitis have a 20% increased long-term risk of atrial fibrillation, but the absolute risk remains low."
30537243,https://doi.org/10.1002/ejhf.1370,"Can advanced analytics fix modern medicine's problem of uncertainty, imprecision, and inaccuracy?","Ahmad T, Freeman JV, Asselbergs FW.",,European journal of heart failure,2019,
32247823,https://doi.org/10.1016/j.jhep.2020.03.032,Genome-wide and Mendelian randomisation studies of liver MRI yield insights into the pathogenesis of steatohepatitis.,"Parisinos CA, Wilman HR, Thomas EL, Kelly M, Nicholls RC, McGonigle J, Neubauer S, Hingorani AD, Patel RS, Hemingway H, Bell JD, Banerjee R, Yaghootkar H.",,Journal of hepatology,2020,"BACKGROUND & AIMS:MRI-based corrected T1 (cT1) is a non-invasive method to grade the severity of steatohepatitis and liver fibrosis. We aimed to identify genetic variants influencing liver cT1 and use genetics to understand mechanisms underlying liver fibroinflammatory disease and its link with other metabolic traits and diseases. METHODS:First, we performed a genome-wide association study (GWAS) in 14,440 Europeans, with liver cT1 measures, from the UK Biobank. Second, we explored the effects of the cT1 variants on liver blood tests, and a range of metabolic traits and diseases. Third, we used Mendelian randomisation to test the causal effects of 24 predominantly metabolic traits on liver cT1 measures. RESULTS:We identified 6 independent genetic variants associated with liver cT1 that reached the GWAS significance threshold (p <5×10-8). Four of the variants (rs759359281 in SLC30A10, rs13107325 in SLC39A8, rs58542926 in TM6SF2, rs738409 in PNPLA3) were also associated with elevated aminotransferases and had variable effects on liver fat and other metabolic traits. Insulin resistance, type 2 diabetes, non-alcoholic fatty liver and body mass index were causally associated with elevated cT1, whilst favourable adiposity (instrumented by variants associated with higher adiposity but lower risk of cardiometabolic disease and lower liver fat) was found to be protective. CONCLUSION:The association between 2 metal ion transporters and cT1 indicates an important new mechanism in steatohepatitis. Future studies are needed to determine whether interventions targeting the identified transporters might prevent liver disease in at-risk individuals. LAY SUMMARY:We estimated levels of liver inflammation and scarring based on magnetic resonance imaging of 14,440 UK Biobank participants. We performed a genetic study and identified variations in 6 genes associated with levels of liver inflammation and scarring. Participants with variations in 4 of these genes also had higher levels of markers of liver cell injury in blood samples, further validating their role in liver health. Two identified genes are involved in the transport of metal ions in our body. Further investigation of these variations may lead to better detection, assessment, and/or treatment of liver inflammation and scarring."
32212911,https://doi.org/10.1161/jaha.119.013684,Prognostic significance of troponin level in 3121 patients presenting with atrial fibrillation (The NIHR Health Informatics Collaborative TROP-AF study).,"Kaura A, Arnold AD, Panoulas V, Glampson B, Davies J, Mulla A, Woods K, Omigie J, Shah AD, Channon KM, Weber JN, Thursz MR, Elliott P, Hemingway H, Williams B, Asselbergs FW, O'Sullivan M, Lord GM, Melikian N, Lefroy DC, Francis DP, Shah AM, Kharbanda R, Perera D, Patel RS, Mayet J.",,Journal of the American Heart Association,2020,"Background Patients presenting with atrial fibrillation (AF) often undergo a blood test to measure troponin, but interpretation of the result is impeded by uncertainty about its clinical importance. We investigated the relationship between troponin level, coronary angiography, and all-cause mortality in real-world patients presenting with AF. Methods and Results We used National Institute of Health Research Health Informatics Collaborative data to identify patients admitted between 2010 and 2017 at 5 tertiary centers in the United Kingdom with a primary diagnosis of AF. Peak troponin results were scaled as multiples of the upper limit of normal. A total of 3121 patients were included in the analysis. Over a median follow-up of 1462 (interquartile range, 929-1975) days, there were 586 deaths (18.8%). The adjusted hazard ratio for mortality associated with a positive troponin (value above upper limit of normal) was 1.20 (95% CI, 1.01-1.43; P<0.05). Higher troponin levels were associated with higher risk of mortality, reaching a maximum hazard ratio of 2.6 (95% CI, 1.9-3.4) at ≈250 multiples of the upper limit of normal. There was an exponential relationship between higher troponin levels and increased odds of coronary angiography. The mortality risk was 36% lower in patients undergoing coronary angiography than in those who did not (adjusted hazard ratio, 0.61; 95% CI, 0.42-0.89; P=0.01). Conclusions Increased troponin was associated with increased risk of mortality in patients presenting with AF. The lower hazard ratio in patients undergoing invasive management raises the possibility that the clinical importance of troponin release in AF may be mediated by coronary artery disease, which may be responsive to revascularization."
30102210,https://doi.org/10.1016/s1470-2045(18)30425-x,A roadmap for restoring trust in Big Data.,"Lawler M, Morris AD, Sullivan R, Birney E, Middleton A, Makaroff L, Knoppers BM, Horgan D, Eggermont A.",,The Lancet. Oncology,2018,
31443926,https://doi.org/10.1016/s0140-6736(19)31674-5,Medium and long-term risks of specific cardiovascular diseases in survivors of 20 adult cancers: a population-based cohort study using multiple linked UK electronic health records databases.,"Strongman H, Gadd S, Matthews A, Mansfield KE, Stanway S, Lyon AR, Dos-Santos-Silva I, Smeeth L, Bhaskaran K.",,"Lancet (London, England)",2019,"BACKGROUND:The past few decades have seen substantial improvements in cancer survival, but concerns exist about long-term cardiovascular disease risk in survivors. Evidence is scarce on the risks of specific cardiovascular diseases in survivors of a wide range of cancers to inform prevention and management. In this study, we used large-scale electronic health records data from multiple linked UK databases to address these evidence gaps. METHODS:For this population-based cohort study, we used linked primary care, hospital, and cancer registry data from the UK Clinical Practice Research Datalink to identify cohorts of survivors of the 20 most common cancers who were 18 years or older and alive 12 months after diagnosis and controls without history of cancer, matched for age, sex, and general practice. We compared risks for a range of cardiovascular disease outcomes using crude and adjusted Cox models. We fitted interactions to investigate effect modification, and flexible parametric survival models to estimate absolute excess risks over time. FINDINGS:Between Jan 1, 1990, and Dec 31, 2015, 126 120 individuals with a diagnosis of a cancer of interest still being followed up at least 1 year later were identified and matched to 630 144 controls. After exclusions, 108 215 cancer survivors and 523 541 controls were included in the main analyses. Venous thromboembolism risk was elevated in survivors of 18 of 20 site-specific cancers compared with that of controls; adjusted hazard ratios (HRs) ranged from 1·72 (95% CI 1·57-1·89) in patients after prostate cancer to 9·72 (5·50-17·18) after pancreatic cancer. HRs decreased over time, but remained elevated more than 5 years after diagnosis. We observed increased risks of heart failure or cardiomyopathy in patients after ten of 20 cancers, including haematological (adjusted HR 1·94, 1·66-2·25, with non-Hodgkin lymphoma; 1·77, 1·50-2·09, with leukaemia; and 3·29, 2·59-4·18, with multiple myeloma), oesophageal (1·96, 1·46-2·64), lung (1·82, 1·52-2·17) kidney (1·73, 1·38-2·17) and ovarian (1·59, 1·19-2·12). Elevated risks of arrhythmia, pericarditis, coronary artery disease, stroke, and valvular heart disease were also observed for multiple cancers, including haematological malignancies. HRs for heart failure or cardiomyopathy and venous thromboembolism were greater in patients without previous cardiovascular disease and in younger patients. However, absolute excess risks were generally greater with increasing age. Increased risks of these outcomes seemed most pronounced in patients who had received chemotherapy. INTERPRETATION:Survivors of most site-specific cancers had increased medium-term to long-term risk for one or more cardiovascular diseases compared with that for the general population, with substantial variations between cancer sites. FUNDING:Wellcome Trust and Royal Society."
